Id,Title,Author,Average Rating,Number of ratings,Year of publishing,Url of image,Genre
824062.God_s_Smuggler,God's Smuggler (Paperback),Brother Andrew,4.23,40541,1964,https://i.gr-assets.com/images/S/compressed.photo.goodreads.com/books/1347829238l/824062._SY75_.jpg,religion
1109255.Jesus_for_President,Jesus for President: Politics for Ordinary Radicals (Paperback),Shane Claiborne,4.01,5783,2007,https://i.gr-assets.com/images/S/compressed.photo.goodreads.com/books/1395613683l/1109255._SX50_.jpg,religion
100812.The_Good_B,The Good Book: Reading the Bible with Mind and Heart (Paperback),Peter J. Gomes,4.08,1464,1996,https://i.gr-assets.com/images/S/compressed.photo.goodreads.com/books/1348823213l/100812._SY75_.jpg,religion
17212231-infern,"Inferno (Robert Langdon, #4)",Dan Brown,3.86,512815,2013,https://i.gr-assets.com/images/S/compressed.photo.goodreads.com/books/1534070896l/17212231._SY75_.jpg,religion
539387.The_Holy_Bible,"The Holy Bible: New American Standard Version, NASB (Hardcover)",Anonymous,4.61,5214,1920,https://i.gr-assets.com/images/S/compressed.photo.goodreads.com/books/1221154843l/539387._SX50_.jpg,religion
36679056-the-incendiarie,The Incendiaries (Hardcover),R.O. Kwon,3.24,20518,2018,https://i.gr-assets.com/images/S/compressed.photo.goodreads.com/books/1512834150l/36679056._SY75_.jpg,religion
1371.The_Iliad,The Iliad (Paperback),Homer,3.88,384387,-800,https://i.gr-assets.com/images/S/compressed.photo.goodreads.com/books/1625333695l/1371._SX50_.jpg,religion
30956087-the-polygamist-s-daughter,The Polygamist's Daughter (Paperback),Anna LeBaron,3.67,7743,2017,https://i.gr-assets.com/images/S/compressed.photo.goodreads.com/books/1468499949l/30956087._SX50_.jpg,religion
9488716-jesus-of-nazareth-part-t,"Jesus of Nazareth, Part Two: Holy Week: From the Entrance into Jerusalem to the Resurrection (Hardcover)",Benedict XVI,4.59,2548,2011,https://i.gr-assets.com/images/S/compressed.photo.goodreads.com/books/1348281523l/9488716._SY75_.jpg,religion
216204.The_Misunderstood_Je,The Misunderstood Jew: The Church and the Scandal of the Jewish Jesus (Hardcover),Amy-Jill Levine,4.06,831,2006,https://i.gr-assets.com/images/S/compressed.photo.goodreads.com/books/1434391881l/216204._SY75_.jpg,religion
54220.Rocks_of_Age,Rocks of Ages: Science and Religion in the Fullness of Life (Paperback),Stephen Jay Gould,3.51,1007,1999,https://i.gr-assets.com/images/S/compressed.photo.goodreads.com/books/1403178229l/54220._SY75_.jpg,religion
351723.Contemplative_Prayer,Contemplative Prayer (Paperback),Thomas Merton,3.98,4702,1969,https://i.gr-assets.com/images/S/compressed.photo.goodreads.com/books/1359986111l/351723._SX50_.jpg,religion
152125.Theory_of_Religion,Theory of Religion (Paperback),Georges Bataille,3.99,604,1973,https://i.gr-assets.com/images/S/compressed.photo.goodreads.com/books/1348968471l/152125._SY75_.jpg,religion
241899.Old_Path_White_Cloud,Old Path White Clouds: Walking in the Footsteps of the Buddha (Paperback),Thich Nhat Hanh,4.22,6101,Null,https://i.gr-assets.com/images/S/compressed.photo.goodreads.com/books/1328767457l/241899._SY75_.jpg,religion
438766.The_Harlot_by_the_Side_of_the_Road,The Harlot by the Side of the Road: Forbidden Tales of the Bible (Paperback),Jonathan Kirsch,3.79,882,1997,https://i.gr-assets.com/images/S/compressed.photo.goodreads.com/books/1320393365l/438766._SX50_.jpg,religion
51330171-no-unhallowed-hand,"No Unhallowed Hand: 1846-1893 (Saints, #2)",The Church of Jesus Christ of Latter-day Saints,4.54,2872,2020,https://i.gr-assets.com/images/S/compressed.photo.goodreads.com/books/1581529569l/51330171._SX50_SY75_.jpg,religion
43383506-we-have-always-been-here,We Have Always Been Here: A Queer Muslim Memoir (Kindle Edition),Samra Habib,4.11,9868,2019,https://i.gr-assets.com/images/S/compressed.photo.goodreads.com/books/1546023982l/43383506._SY75_.jpg,religion
20893347-prayer,Prayer: Experiencing Awe and Intimacy with God (Hardcover),Timothy J. Keller,4.28,10086,2014,https://i.gr-assets.com/images/S/compressed.photo.goodreads.com/books/1403206661l/20893347._SY75_.jpg,religion
27863812-planted,Planted: Belief and Belonging in an Age of Doubt (Paperback),Patrick Q. Mason,4.3,1025,Null,https://i.gr-assets.com/images/S/compressed.photo.goodreads.com/books/1447995681l/27863812._SY75_.jpg,religion
17332278-a-prayer-journal,A Prayer Journal (Hardcover),Flannery O'Connor,4.11,2533,2013,https://i.gr-assets.com/images/S/compressed.photo.goodreads.com/books/1362225783l/17332278._SX50_.jpg,religion
12611073-the-harbinger,The Harbinger: The Ancient Mystery that Holds the Secret of America's Future (Paperback),Jonathan Cahn,3.94,23853,2011,https://i.gr-assets.com/images/S/compressed.photo.goodreads.com/books/1345009097l/12611073._SX50_.jpg,religion
11510112-man-seeks-god,Man Seeks God: My Flirtations with the Divine (Hardcover),Eric    Weiner,3.72,1868,2011,https://i.gr-assets.com/images/S/compressed.photo.goodreads.com/books/1321677060l/11510112._SY75_.jpg,religion
17335.C_S_Lewis_Signature_Classic,C.S. Lewis Signature Classics (Paperback),C.S. Lewis,4.3,4235,2001,https://i.gr-assets.com/images/S/compressed.photo.goodreads.com/books/1434815468l/17335._SY75_.jpg,religion
398085.The_Art_of_Biblical_Narrative,The Art of Biblical Narrative (Paperback),Robert Alter,4.25,1279,1981,https://i.gr-assets.com/images/S/compressed.photo.goodreads.com/books/1348143076l/398085._SY75_.jpg,religion
103335.Jesu,"Jesus: Uncovering the Life, Teachings, and Relevance of a Religious Revolutionary (Hardcover)",Marcus J. Borg,4.21,1053,2006,https://i.gr-assets.com/images/S/compressed.photo.goodreads.com/books/1348198320l/103335._SY75_.jpg,religion
7144.Crime_and_Punishment,Crime and Punishment (Paperback),Fyodor Dostoevsky,4.23,714625,1866,https://i.gr-assets.com/images/S/compressed.photo.goodreads.com/books/1382846449l/7144._SY75_.jpg,religion
89448.A_History_of_Christianity,A History of Christianity (Paperback),Paul  Johnson,3.94,880,1976,https://i.gr-assets.com/images/S/compressed.photo.goodreads.com/books/1348286589l/89448._SY75_.jpg,religion
820465.The_White_Godde,The White Goddess: A Historical Grammar of Poetic Myth (Paperback),Robert Graves,4.03,3386,1948,https://i.gr-assets.com/images/S/compressed.photo.goodreads.com/books/1311971301l/820465._SY75_.jpg,religion
4406.East_of_Eden,East of Eden (Paperback),John Steinbeck,4.38,464779,1952,https://i.gr-assets.com/images/S/compressed.photo.goodreads.com/books/1623105385l/4406._SY75_.jpg,religion
34503571-the-book-of-essie,The Book of Essie (Kindle Edition),Meghan MacLean Weir,3.92,27580,2018,https://i.gr-assets.com/images/S/compressed.photo.goodreads.com/books/1515874042l/34503571._SX50_.jpg,religion
25489134-the-bear-and-the-nightingale,"The Bear and the Nightingale (The Winternight Trilogy, #1)",Katherine Arden,4.08,153350,2017,https://i.gr-assets.com/images/S/compressed.photo.goodreads.com/books/1611440212l/25489134._SX50_.jpg,religion
18490563-headscarves-and-hymen,Headscarves and Hymens: Why the Middle East Needs a Sexual Revolution (Hardcover),Mona Eltahawy,4.16,3814,2015,https://i.gr-assets.com/images/S/compressed.photo.goodreads.com/books/1403430338l/18490563._SX50_.jpg,religion
7841392-american-grace,American Grace: How Religion Divides and Unites Us (Hardcover),Robert D. Putnam,3.91,981,2010,https://i.gr-assets.com/images/S/compressed.photo.goodreads.com/books/1438757983l/7841392._SY75_.jpg,religion
14741709-through-the-eye-of-a-needle,"Through the Eye of a Needle: Wealth, the Fall of Rome & the Making of Christianity in the West, 350-550 AD (Hardcover)",Peter R.L. Brown,4.31,528,2012,https://i.gr-assets.com/images/S/compressed.photo.goodreads.com/books/1388288257l/14741709._SY75_.jpg,religion
15793626-my-bright-aby,My Bright Abyss: Meditation of a Modern Believer (Hardcover),Christian Wiman,3.88,4148,2013,https://i.gr-assets.com/images/S/compressed.photo.goodreads.com/books/1344319638l/15793626._SY75_.jpg,religion
14741364-brigham-young,Brigham Young: Pioneer Prophet (Hardcover),John G. Turner,4.03,1037,2012,https://i.gr-assets.com/images/S/compressed.photo.goodreads.com/books/1338403298l/14741364._SY75_.jpg,religion
10950924-the-dovekeeper,The Dovekeepers (Hardcover),Alice Hoffman,4.05,71566,2011,https://i.gr-assets.com/images/S/compressed.photo.goodreads.com/books/1306253903l/10950924._SY75_.jpg,religion
10429092-the-girl-of-fire-and-thorn,"The Girl of Fire and Thorns (Fire and Thorns, #1)",Rae Carson,3.79,78678,2011,https://i.gr-assets.com/images/S/compressed.photo.goodreads.com/books/1323448113l/10429092._SY75_.jpg,religion
360625.Mary_Called_Magdalene,"Mary, Called Magdalene (Paperback)",Margaret George,3.88,8415,2002,https://i.gr-assets.com/images/S/compressed.photo.goodreads.com/books/1388463918l/360625._SY75_.jpg,religion
6314709-lost-boy,Lost Boy (Hardcover),Brent W. Jeffs,3.87,3576,2009,https://i.gr-assets.com/images/S/compressed.photo.goodreads.com/books/1320414384l/6314709._SY75_.jpg,religion
28029.Myth_and_Reality,Myth and Reality (Paperback),Mircea Eliade,4.09,920,1962,https://i.gr-assets.com/images/S/compressed.photo.goodreads.com/books/1387665151l/28029._SY75_.jpg,religion
198833.The_Cult_of_the_Saint,The Cult of the Saints: Its Rise and Function in Latin Christianity (Paperback),Peter R.L. Brown,3.96,708,1981,https://i.gr-assets.com/images/S/compressed.photo.goodreads.com/books/1328874480l/198833._SY75_.jpg,religion
12609.The_Spirit_Catches_You_and_You_Fall_Down,"The Spirit Catches You and You Fall Down: A Hmong Child, Her American Doctors, and the Collision of Two Cultures (Paperback)",Anne Fadiman,4.16,76514,1997,https://i.gr-assets.com/images/S/compressed.photo.goodreads.com/books/1432610033l/12609._SY75_.jpg,religion
410758.The_New_Testament_and_the_People_of_God,"The New Testament and the People of God (Christian Origins and the Question of God, #1)",N.T. Wright,4.39,2457,1991,https://i.gr-assets.com/images/S/compressed.photo.goodreads.com/books/1421264779l/410758._SX50_.jpg,religion
820966.The_Bondage_of_the_Will,The Bondage of the Will (Paperback),Martin Luther,4.08,8219,1525,https://i.gr-assets.com/images/S/compressed.photo.goodreads.com/books/1347987673l/820966._SY75_.jpg,religion
123653.The_Book_of_the_La,The Book of the Law (Hardcover),Aleister Crowley,3.83,4264,1904,https://i.gr-assets.com/images/S/compressed.photo.goodreads.com/books/1388246246l/123653._SX50_.jpg,religion
782832.Soul_Survivor,Soul Survivor: How Thirteen Unlikely Mentors Helped My Faith Survive the Church (Paperback),Philip Yancey,4.22,3740,2001,https://i.gr-assets.com/images/S/compressed.photo.goodreads.com/books/1320524528l/782832._SX50_.jpg,religion
75508.Choosing_a_Jewish_Life,Choosing a Jewish Life: A Handbook for People Converting to Judaism and for Their Family and Friends (Paperback),Anita Diamant,4.17,1768,1998,https://i.gr-assets.com/images/S/compressed.photo.goodreads.com/books/1403188643l/75508._SY75_.jpg,religion
200137.Ethics_for_the_New_Millennium,Ethics for the New Millennium (Paperback),Dalai Lama XIV,3.94,5236,1999,https://i.gr-assets.com/images/S/compressed.photo.goodreads.com/books/1348928033l/200137._SY75_.jpg,religion
193591.Major_Trends_in_Jewish_Mysticism,Major Trends in Jewish Mysticism (Paperback),Gershom Scholem,4.28,500,1929,https://i.gr-assets.com/images/S/compressed.photo.goodreads.com/books/1430736762l/193591._SY75_.jpg,religion
123636.Psychology_and_Religion,Psychology and Religion (Paperback),C.G. Jung,4.13,1874,1940,https://i.gr-assets.com/images/S/compressed.photo.goodreads.com/books/1441056398l/123636._SY75_.jpg,religion
6676685,المنقذ من الضلال والمفصح بالأحوال (Paperback),Abu Hamid al-Ghazali,4.03,2236,1107,https://i.gr-assets.com/images/S/compressed.photo.goodreads.com/books/1249436410l/6676685._SX50_.jpg,religion
4251.Truth_and_Fiction_in_The_Da_Vinci_Code,"Truth and Fiction in The Da Vinci Code: A Historian Reveals What We Really Know about Jesus, Mary Magdalene & Constantine (Paperback)",Bart D. Ehrman,3.66,783,2004,https://i.gr-assets.com/images/S/compressed.photo.goodreads.com/books/1421564508l/4251._SY75_.jpg,religion
25816844-the-sin-of-certainty,"The Sin of Certainty: Why God Desires Our Trust More Than Our ""Correct"" Beliefs (Hardcover)",Peter Enns,4.24,2445,2016,https://i.gr-assets.com/images/S/compressed.photo.goodreads.com/books/1447805007l/25816844._SY75_.jpg,religion
14864.Plain_Trut,Plain Truth (Hardcover),Jodi Picoult,3.97,173222,2000,https://i.gr-assets.com/images/S/compressed.photo.goodreads.com/books/1389750843l/14864._SY75_.jpg,religion
13593814-cold-case-christianity,Cold-Case Christianity: A Homicide Detective Investigates the Claims of the Gospels (Paperback),J. Warner Wallace,4.36,3525,2013,https://i.gr-assets.com/images/S/compressed.photo.goodreads.com/books/1345683733l/13593814._SX50_.jpg,religion
1448527.The_Secret_Of_The_Rosary,The Secret Of The Rosary (Paperback),Louis de Montfort,4.49,2883,1710,https://i.gr-assets.com/images/S/compressed.photo.goodreads.com/books/1387300830l/1448527._SY75_.jpg,religion
503150.Letters_to_a_Young_Contrarian,Letters to a Young Contrarian (Paperback),Christopher Hitchens,4.13,10881,2001,https://i.gr-assets.com/images/S/compressed.photo.goodreads.com/books/1576449566l/503150._SY75_.jpg,religion
27307.In_the_Beginning,In the Beginning: A New Interpretation of Genesis (Paperback),Karen Armstrong,3.85,675,1996,https://i.gr-assets.com/images/S/compressed.photo.goodreads.com/books/1388847817l/27307._SY75_.jpg,religion
345220.Seductive_Poison,Seductive Poison: A Jonestown Survivor's Story of Life and Death in the Peoples Temple (Paperback),Deborah Layton,4.1,3126,1997,https://i.gr-assets.com/images/S/compressed.photo.goodreads.com/books/1403173652l/345220._SY75_.jpg,religion
271652.God_of_the_Oppressed,God of the Oppressed (Paperback),James H. Cone,4.29,923,2012,https://i.gr-assets.com/images/S/compressed.photo.goodreads.com/books/1386922707l/271652._SY75_.jpg,religion
358936.A_History_of_the_Je,A History of the Jews (Paperback),Paul  Johnson,4.13,2099,1987,https://i.gr-assets.com/images/S/compressed.photo.goodreads.com/books/1388331892l/358936._SY75_.jpg,religion
592737.Joseph_Smith_the_Prophet,Joseph Smith the Prophet (Hardcover),Truman G. Madsen,4.48,2538,1978,https://i.gr-assets.com/images/S/compressed.photo.goodreads.com/books/1418844376l/592737._SY75_.jpg,religion
55338982-culti,Cultish: The Language of Fanaticism (Hardcover),Amanda Montell,4.17,7284,2021,https://i.gr-assets.com/images/S/compressed.photo.goodreads.com/books/1603741877l/55338982._SX50_.jpg,religion
28268515-the-road-back-to-you,The Road Back to You: An Enneagram Journey to Self-Discovery (Hardcover),Ian Morgan Cron,4.18,43726,2016,https://i.gr-assets.com/images/S/compressed.photo.goodreads.com/books/1463950490l/28268515._SY75_.jpg,religion
27840555-no-god-but-one,No God but One: Allah or Jesus?: A Former Muslim Investigates the Evidence for Islam and Christianity (Paperback),Nabeel Qureshi,4.62,2368,2016,https://i.gr-assets.com/images/S/compressed.photo.goodreads.com/books/1460248950l/27840555._SY75_.jpg,religion
24727435-not-in-god-s-name,Not in God's Name: Confronting Religious Violence (Hardcover),Jonathan Sacks,4.34,1091,2015,https://i.gr-assets.com/images/S/compressed.photo.goodreads.com/books/1433411446l/24727435._SX50_.jpg,religion
5113.Franny_and_Zooey,Franny and Zooey (Paperback),J.D. Salinger,3.97,196275,1957,https://i.gr-assets.com/images/S/compressed.photo.goodreads.com/books/1355037988l/5113._SY75_.jpg,religion
12187334-short-stories-by-jesu,Short Stories by Jesus: The Enigmatic Parables of a Controversial Rabbi (Hardcover),Amy-Jill Levine,4.0,1070,2014,https://i.gr-assets.com/images/S/compressed.photo.goodreads.com/books/1379392760l/12187334._SX50_.jpg,religion
405509.Mudhouse_Sabbat,Mudhouse Sabbath (Hardcover),Lauren F. Winner,3.85,5724,2003,https://i.gr-assets.com/images/S/compressed.photo.goodreads.com/books/1437363971l/405509._SX50_.jpg,religion
13260505-paul-and-jesu,Paul and Jesus: How the Apostle Transformed Christianity (Paperback),James D. Tabor,4.0,659,2012,https://i.gr-assets.com/images/S/compressed.photo.goodreads.com/books/1405260123l/13260505._SY75_.jpg,religion
13529088-why-did-jesus-moses-the-buddha-and-mohammed-cross-the-road,"Why Did Jesus, Moses, the Buddha, and Mohammed Cross the Road?: Christian Identity in a Multi-Faith World (Hardcover)",Brian D. McLaren,4.02,1328,2012,https://i.gr-assets.com/images/S/compressed.photo.goodreads.com/books/1416121730l/13529088._SY75_.jpg,religion
7332753-hitch-22,Hitch 22: A Memoir (Hardcover),Christopher Hitchens,3.95,22032,2010,https://i.gr-assets.com/images/S/compressed.photo.goodreads.com/books/1327906136l/7332753._SY75_.jpg,religion
80207.A_New_Christianity_for_a_New_World,A New Christianity for a New World: Why Traditional Faith is Dying  How a New Faith is Being Born (Paperback),John Shelby Spong,3.96,811,2001,https://i.gr-assets.com/images/S/compressed.photo.goodreads.com/books/1424360365l/80207._SY75_.jpg,religion
71646.The_Gospel_of_Mary_of_Magdala,The Gospel of Mary of Magdala (Paperback),Karen L. King,4.05,1016,2003,https://i.gr-assets.com/images/S/compressed.photo.goodreads.com/books/1348217131l/71646._SY75_.jpg,religion
27035.The_Early_Churc,"The Early Church (The Pelican History of the Church, #1)",Henry Chadwick,3.93,1617,1967,https://i.gr-assets.com/images/S/compressed.photo.goodreads.com/books/1380534421l/27035._SY75_.jpg,religion
123632.Man_and_His_Symbol,Man and His Symbols (Mass Market Paperback),C.G. Jung,4.16,24050,1964,https://i.gr-assets.com/images/S/compressed.photo.goodreads.com/books/1327336291l/123632._SY75_.jpg,religion
151390.The_Letters_of_Ab_lard_and_H_lo_se,The Letters of Abélard and Héloïse (Paperback),Pierre Abélard,3.75,4224,1133,https://i.gr-assets.com/images/S/compressed.photo.goodreads.com/books/1539475646l/151390._SY75_.jpg,religion
65549.Hostage_to_the_Devil,Hostage to the Devil: The Possession and Exorcism of Five Contemporary Americans (Paperback),Malachi Martin,3.93,1948,1976,https://i.gr-assets.com/images/S/compressed.photo.goodreads.com/books/1388256838l/65549._SY75_.jpg,religion
11691.Sn,Snow (Paperback),Orhan Pamuk,3.59,45002,2002,https://i.gr-assets.com/images/S/compressed.photo.goodreads.com/books/1357684424l/11691._SY75_.jpg,religion
95734.Anger,Anger: Wisdom for Cooling the Flames (Paperback),Thich Nhat Hanh,3.97,10711,2001,https://i.gr-assets.com/images/S/compressed.photo.goodreads.com/books/1631501820l/95734._SY75_.jpg,religion
2082009.The_Little_Book_of_Atheist_Spirituality,The Little Book of Atheist Spirituality (Hardcover),André Comte-Sponville,3.81,1210,2006,https://i.gr-assets.com/images/S/compressed.photo.goodreads.com/books/1442859322l/2082009._SX50_.jpg,religion
89376.Heaven,Heaven (Hardcover),Randy Alcorn,4.21,11787,2004,https://i.gr-assets.com/images/S/compressed.photo.goodreads.com/books/1406508230l/89376._SY75_.jpg,religion
100100.The_Prophet,The Prophets (Paperback),Abraham Joshua Heschel,4.41,1097,1962,https://i.gr-assets.com/images/S/compressed.photo.goodreads.com/books/1384259206l/100100._SX50_.jpg,religion
347143.The_Abstinence_Teacher,The Abstinence Teacher (Hardcover),Tom Perrotta,3.25,16741,2007,https://i.gr-assets.com/images/S/compressed.photo.goodreads.com/books/1320459201l/347143._SY75_.jpg,religion
19380.Candide,Candide (Paperback),Voltaire,3.77,239235,1759,https://i.gr-assets.com/images/S/compressed.photo.goodreads.com/books/1345060082l/19380._SY75_.jpg,religion
53146675-verita,"Veritas: A Harvard Professor, a Con Man and the Gospel of Jesus's Wife (Hardcover)",Ariel Sabar,4.13,1075,2020,https://i.gr-assets.com/images/S/compressed.photo.goodreads.com/books/1574742295l/53146675._SX50_SY75_.jpg,religion
29780253-born-a-crime,Born a Crime: Stories From a South African Childhood (Hardcover),Trevor Noah,4.45,510574,2016,https://i.gr-assets.com/images/S/compressed.photo.goodreads.com/books/1473867911l/29780253._SY75_.jpg,religion
35959740-circe,Circe (Hardcover),Madeline Miller,4.26,557009,2018,https://i.gr-assets.com/images/S/compressed.photo.goodreads.com/books/1565909496l/35959740._SY75_.jpg,religion
31123249-saints-and-misfit,Saints and Misfits (Audiobook),S.K. Ali,3.8,6578,2017,https://i.gr-assets.com/images/S/compressed.photo.goodreads.com/books/1537980995l/31123249._SX50_.jpg,religion
18210814-american-crucifixion,American Crucifixion: The Murder of Joseph Smith and the Fate of the Mormon Church (Hardcover),Alex Beam,3.64,925,2014,https://i.gr-assets.com/images/S/compressed.photo.goodreads.com/books/1374655049l/18210814._SY75_.jpg,religion
19335902-evangelii-gaudium,Evangelii Gaudium: The Joy of the Gospel (Paperback),Pope Francis,4.45,2137,2013,https://i.gr-assets.com/images/S/compressed.photo.goodreads.com/books/1386799320l/19335902._SX50_.jpg,religion
5705398-the-first-paul,The First Paul: Reclaiming the Radical Visionary Behind the Church's Conservative Icon (Hardcover),Marcus J. Borg,4.09,903,2009,https://i.gr-assets.com/images/S/compressed.photo.goodreads.com/books/1442844810l/5705398._SY75_.jpg,religion
797385.Acts_of_Fait,"Acts of Faith: The Story of an American Muslim, the Struggle for the Soul of a Generation (Hardcover)",Eboo Patel,3.99,1704,2007,https://i.gr-assets.com/images/S/compressed.photo.goodreads.com/books/1389222438l/797385._SY75_.jpg,religion
193586.Mysticism,Mysticism: A Study in the Nature and Development of Spiritual Consciousness (Paperback),Evelyn Underhill,3.76,3137,1911,https://i.gr-assets.com/images/S/compressed.photo.goodreads.com/books/1388248021l/193586._SY75_.jpg,religion
53673.The_Devils_of_Loudun,The Devils of Loudun (Paperback),Aldous Huxley,3.88,2536,1952,https://i.gr-assets.com/images/S/compressed.photo.goodreads.com/books/1320523772l/53673._SY75_.jpg,religion
6262529-a-people-s-history-of-christianity,A People's History of Christianity: The Other Side of the Story (Hardcover),Diana Butler Bass,3.88,918,2009,https://i.gr-assets.com/images/S/compressed.photo.goodreads.com/books/1348908495l/6262529._SX50_.jpg,religion
183683.The_Secret_Teachings_of_All_Age,The Secret Teachings of All Ages (Paperback),Manly P. Hall,4.1,6099,1928,https://i.gr-assets.com/images/S/compressed.photo.goodreads.com/books/1547198644l/183683._SX50_.jpg,religion
3329064-acedia-me,"Acedia & Me: A Marriage, Monks, and a Writer's Life (Hardcover)",Kathleen Norris,3.67,4134,2008,https://i.gr-assets.com/images/S/compressed.photo.goodreads.com/books/1442340583l/3329064._SY75_.jpg,religion
545867.The_Jesus_Dynasty,"The Jesus Dynasty: The Hidden History of Jesus, His Royal Family and the Birth of Christianity (Hardcover)",James D. Tabor,3.94,891,2006,https://i.gr-assets.com/images/S/compressed.photo.goodreads.com/books/1441559388l/545867._SY75_.jpg,religion
270807.Burned,"Burned (Burned, #1)",Ellen Hopkins,4.25,59569,2006,https://i.gr-assets.com/images/S/compressed.photo.goodreads.com/books/1388719598l/270807._SX50_.jpg,religion
784153.The_Bible,The Bible: A Very Short Introduction (Paperback),John Riches,3.31,264,2000,https://i.gr-assets.com/images/S/compressed.photo.goodreads.com/books/1347988246l/784153._SY75_.jpg,religion
170666.A_Witches_Bible,A Witches' Bible: The Complete Witches' Handbook (Paperback),Janet Farrar,3.9,4316,1987,https://i.gr-assets.com/images/S/compressed.photo.goodreads.com/books/1321274377l/170666._SY75_.jpg,religion
258014.Mama_Lola,Mama Lola: A Vodou Priestess in Brooklyn (Comparative Studies in Religion and Society),Karen McCarthy Brown,4.0,1159,1991,https://i.gr-assets.com/images/S/compressed.photo.goodreads.com/books/1386924853l/258014._SY75_.jpg,religion
227354.1453,1453: The Holy War for Constantinople and the Clash of Islam and the West (Paperback),Roger Crowley,4.23,5013,2005,https://i.gr-assets.com/images/S/compressed.photo.goodreads.com/books/1434196467l/227354._SY75_.jpg,religion
112073.Small_Catechism_with_Explanation,"Small Catechism, with Explanation (Unknown Binding)",Martin Luther,4.33,1332,1529,https://i.gr-assets.com/images/S/compressed.photo.goodreads.com/books/1387731159l/112073._SY75_.jpg,religion
6405093-there-s-probably-no-god,There's Probably No God: The Atheists' Guide to Christmas (Hardcover),Ariane Sherine,3.59,1392,2009,https://i.gr-assets.com/images/S/compressed.photo.goodreads.com/books/1327198791l/6405093._SX50_.jpg,religion
10860921-the-story,"The Story: The Bible as One Continuing Story of God and His People, NIV (Hardcover)",Randy Frazee,4.19,6244,1996,https://i.gr-assets.com/images/S/compressed.photo.goodreads.com/books/1369202995l/10860921._SY75_.jpg,religion
147635.Holy_Bible,Holy Bible: Revised Standard Version,Anonymous,4.47,1990,1972,https://i.gr-assets.com/images/S/compressed.photo.goodreads.com/books/1172188595l/147635._SY75_.jpg,religion
3272346-the-bible,The Bible: Authorized King James Version with Apocrypha (Paperback),Anonymous,3.83,707,1611,https://i.gr-assets.com/images/S/compressed.photo.goodreads.com/books/1468113928l/3272346._SY75_.jpg,religion
23647129-for-the-love,For the Love: Fighting for Grace in a World of Impossible Standards (Hardcover),Jen Hatmaker,4.07,26735,2015,https://i.gr-assets.com/images/S/compressed.photo.goodreads.com/books/1426296433l/23647129._SY75_.jpg,religion
18050104-cut-me-loose,Cut Me Loose: Sin and Salvation After My Ultra-Orthodox Girlhood (Hardcover),Leah Vincent,3.69,2831,2014,https://i.gr-assets.com/images/S/compressed.photo.goodreads.com/books/1389591887l/18050104._SX50_.jpg,religion
16000325-beyond-belief,Beyond Belief: The Secret Lives of Women in Extreme Religions (Paperback),Cami Ostman,3.47,430,2013,https://i.gr-assets.com/images/S/compressed.photo.goodreads.com/books/1360650820l/16000325._SX50_.jpg,religion
13167816-nonbeliever-nation,Nonbeliever Nation: The Rise of Secular Americans (Hardcover),David Niose,4.03,604,2012,https://i.gr-assets.com/images/S/compressed.photo.goodreads.com/books/1344321731l/13167816._SY75_.jpg,religion
