Id,Title,Author,Average Rating,Number of ratings,Year of publishing,Url of image,Genre
370774.Revelations_of_Divine_Love,Revelations of Divine Love (Paperback),Julian of Norwich,3.88,7366,1393,https://i.gr-assets.com/images/S/compressed.photo.goodreads.com/books/1420607880l/370774._SY75_.jpg,religion
117531.Dark_Night_of_the_Soul,Dark Night of the Soul (Paperback),John of the Cross,4.1,10442,1584,https://i.gr-assets.com/images/S/compressed.photo.goodreads.com/books/1328865417l/117531._SY75_.jpg,religion
596290.A_Marvelous_Work_and_a_Wonder,A Marvelous Work and a Wonder (Mass Market Paperback),LeGrand Richards,4.34,9098,1950,https://i.gr-assets.com/images/S/compressed.photo.goodreads.com/books/1418843656l/596290._SY75_.jpg,religion
40726412-the-road-to-jonestown,The Road to Jonestown: Jim Jones and Peoples Temple (Kindle Edition),Jeff Guinn,4.16,12206,2017,https://i.gr-assets.com/images/S/compressed.photo.goodreads.com/books/1530811731l/40726412._SY75_.jpg,religion
52698452-the-book-of-longing,The Book of Longings (Hardcover),Sue Monk Kidd,4.23,85474,2020,https://i.gr-assets.com/images/S/compressed.photo.goodreads.com/books/1570801291l/52698452._SX50_SY75_.jpg,religion
991544.Bhagavad_Gita_As_It_I,Bhagavad-Gita As It Is (Hardcover),A.C. Bhaktivedanta Swami Prabhupāda,4.13,7575,1968,https://i.gr-assets.com/images/S/compressed.photo.goodreads.com/books/1528088332l/991544._SX50_.jpg,religion
69095.American_Fascist,American Fascists: The Christian Right and the War on America (Hardcover),Chris Hedges,4.0,3959,2007,https://i.gr-assets.com/images/S/compressed.photo.goodreads.com/books/1440626012l/69095._SY75_.jpg,religion
13529055-mortality,Mortality (Hardcover),Christopher Hitchens,4.06,26899,2012,https://i.gr-assets.com/images/S/compressed.photo.goodreads.com/books/1337177391l/13529055._SY75_.jpg,religion
175510.My_Utmost_for_His_Highest,My Utmost for His Highest (Paperback),Oswald Chambers,4.34,72910,1926,https://i.gr-assets.com/images/S/compressed.photo.goodreads.com/books/1389470852l/175510._SY75_.jpg,religion
90557.Buddhism_without_Belief,Buddhism without Beliefs: A Contemporary Guide to Awakening (Paperback),Stephen Batchelor,3.94,9607,1997,https://i.gr-assets.com/images/S/compressed.photo.goodreads.com/books/1430001192l/90557._SY75_.jpg,religion
13547234-the-testament-of-mary,The Testament of Mary (Hardcover),Colm Tóibín,3.63,15075,2012,https://i.gr-assets.com/images/S/compressed.photo.goodreads.com/books/1339797728l/13547234._SY75_.jpg,religion
2319645.Surprised_by_Hope,"Surprised by Hope: Rethinking Heaven, the Resurrection, and the Mission of the Church (Hardcover)",N.T. Wright,4.26,12865,2007,https://i.gr-assets.com/images/S/compressed.photo.goodreads.com/books/1347624226l/2319645._SX50_.jpg,religion
6117055-the-greatest-show-on-eart,The Greatest Show on Earth: The Evidence for Evolution (Hardcover),Richard Dawkins,4.14,52160,2009,https://i.gr-assets.com/images/S/compressed.photo.goodreads.com/books/1302127919l/6117055._SY75_.jpg,religion
314102.Religion_and_the_Decline_of_Magic,Religion and the Decline of Magic: Studies in Popular Beliefs in Sixteenth and Seventeenth Century England (Paperback),Keith Thomas,4.16,1360,1971,https://i.gr-assets.com/images/S/compressed.photo.goodreads.com/books/1387733060l/314102._SY75_.jpg,religion
50793705-heaven-and-hell,Heaven and Hell: A History of the Afterlife (Hardcover),Bart D. Ehrman,4.05,3966,2020,https://i.gr-assets.com/images/S/compressed.photo.goodreads.com/books/1575812957l/50793705._SY75_.jpg,religion
64023.Celebration_of_Discipline,Celebration of Discipline: The Path to Spiritual Growth (Hardcover),Richard J. Foster,4.14,35987,1978,https://i.gr-assets.com/images/S/compressed.photo.goodreads.com/books/1440657038l/64023._SX50_.jpg,religion
20697435-the-book-of-strange-new-thing,The Book of Strange New Things (Hardcover),Michel Faber,3.68,30665,2014,https://i.gr-assets.com/images/S/compressed.photo.goodreads.com/books/1394824754l/20697435._SX50_.jpg,religion
46676.When_Bad_Things_Happen_to_Good_People,When Bad Things Happen to Good People (Paperback),Harold S. Kushner,3.95,18063,1981,https://i.gr-assets.com/images/S/compressed.photo.goodreads.com/books/1388192408l/46676._SY75_.jpg,religion
687278.When_Things_Fall_Apart,When Things Fall Apart: Heart Advice for Difficult Times (Paperback),Pema Chödrön,4.25,45456,1996,https://i.gr-assets.com/images/S/compressed.photo.goodreads.com/books/1320553046l/687278._SY75_.jpg,religion
5043.The_Pillars_of_the_Eart,"The Pillars of the Earth (Kingsbridge, #1)",Ken Follett,4.32,695313,1989,https://i.gr-assets.com/images/S/compressed.photo.goodreads.com/books/1576956100l/5043._SY75_.jpg,religion
7497897-radical,Radical: Taking Back Your Faith from the American Dream (Paperback),David Platt,4.15,56457,2010,https://i.gr-assets.com/images/S/compressed.photo.goodreads.com/books/1333580811l/7497897._SY75_.jpg,religion
6829199-the-jesuit-guide-to-almost-everything,The Jesuit Guide to (Almost) Everything: A Spirituality for Real Life,James     Martin,4.11,7649,2010,https://i.gr-assets.com/images/S/compressed.photo.goodreads.com/books/1347769038l/6829199._SY75_.jpg,religion
596304.Lectures_on_Fait,Lectures on Faith (Hardcover),Joseph Smith Jr.,4.49,5493,1835,https://i.gr-assets.com/images/S/compressed.photo.goodreads.com/books/1395510792l/596304._SY75_.jpg,religion
146064.Jesus_Land,Jesus Land: A Memoir (Paperback),Julia Scheeres,3.94,18879,2005,https://i.gr-assets.com/images/S/compressed.photo.goodreads.com/books/1439587814l/146064._SY75_.jpg,religion
545425._,الرحيق المختوم (Hardcover),Safiur Rahman Mubarakpuri,4.59,19178,1979,https://i.gr-assets.com/images/S/compressed.photo.goodreads.com/books/1289025514l/545425._SX50_.jpg,religion
17570843-jesus-feminist,Jesus Feminist: An Invitation to Revisit the Bible's View of Women (ebook),Sarah Bessey,3.83,11600,2013,https://i.gr-assets.com/images/S/compressed.photo.goodreads.com/books/1401057157l/17570843._SY75_.jpg,religion
778581.A_History_of_Religious_Ideas_1,A History of Religious Ideas 1: From the Stone Age to the Eleusinian Mysteries (Paperback),Mircea Eliade,4.44,1385,1975,https://i.gr-assets.com/images/S/compressed.photo.goodreads.com/books/1588626471l/778581._SY75_.jpg,religion
6411961-the-lost-symbol,"The Lost Symbol (Robert Langdon, #3)",Dan Brown,3.73,566789,2009,https://i.gr-assets.com/images/S/compressed.photo.goodreads.com/books/1534070883l/6411961._SY75_.jpg,religion
144937.The_Idea_of_the_Holy,The Idea of the Holy (Paperback),Rudolf Otto,4.05,1267,1917,https://i.gr-assets.com/images/S/compressed.photo.goodreads.com/books/1371431855l/144937._SY75_.jpg,religion
452392.Articles_of_Fait,Articles of Faith (Missionary Reference Library),James E. Talmage,4.42,6736,1899,https://i.gr-assets.com/images/S/compressed.photo.goodreads.com/books/1418843431l/452392._SY75_.jpg,religion
173526.The_Ragamuffin_Gospel,"The Ragamuffin Gospel: Good News for the Bedraggled, Beat-Up, and Burnt Out (Paperback)",Brennan Manning,4.14,36896,1990,https://i.gr-assets.com/images/S/compressed.photo.goodreads.com/books/1266488592l/173526._SY75_.jpg,religion
74657.Buddhism,Buddhism: A Very Short Introduction (Paperback),Damien Keown,3.73,1989,1996,https://i.gr-assets.com/images/S/compressed.photo.goodreads.com/books/1388193570l/74657._SY75_.jpg,religion
35133923-everything-happens-for-a-reason,Everything Happens for a Reason: And Other Lies I've Loved (Hardcover),Kate Bowler,3.78,33958,2018,https://i.gr-assets.com/images/S/compressed.photo.goodreads.com/books/1504731691l/35133923._SY75_.jpg,religion
80313.Dialogues_Concerning_Natural_Religion,Dialogues Concerning Natural Religion (Paperback),David Hume,3.97,5274,1751,https://i.gr-assets.com/images/S/compressed.photo.goodreads.com/books/1405624519l/80313._SY75_.jpg,religion
89375.90_Minutes_in_Heaven,90 Minutes in Heaven: A True Story of Death and Life (Paperback),Don Piper,3.94,90717,2004,https://i.gr-assets.com/images/S/compressed.photo.goodreads.com/books/1441247008l/89375._SY75_.jpg,religion
658.The_Kingdom_of_God_Is_Within_You,The Kingdom of God Is Within You (Paperback),Leo Tolstoy,4.11,3886,1893,https://i.gr-assets.com/images/S/compressed.photo.goodreads.com/books/1328863873l/658._SY75_.jpg,religion
8508.The_Jefferson_Bible,The Jefferson Bible: The Life and Morals of Jesus of Nazareth (Hardcover),Thomas Jefferson,3.83,2389,1819,https://i.gr-assets.com/images/S/compressed.photo.goodreads.com/books/1388807772l/8508._SY75_.jpg,religion
6596.The_Four_Agreement,The Four Agreements: A Practical Guide to Personal Freedom (Hardcover),Miguel Ruiz,4.16,261360,1997,https://i.gr-assets.com/images/S/compressed.photo.goodreads.com/books/1630664059l/6596._SY75_.jpg,religion
44767458-dune,"Dune (Dune, #1)",Frank Herbert,4.24,968089,1965,https://i.gr-assets.com/images/S/compressed.photo.goodreads.com/books/1555447414l/44767458._SY75_.jpg,religion
73869.The_Spiral_Dance,The Spiral Dance: A Rebirth of the Ancient Religion of the Great Goddess (Paperback),Starhawk,3.97,10935,Null,https://i.gr-assets.com/images/S/compressed.photo.goodreads.com/books/1348517478l/73869._SX50_.jpg,religion
483701.The_History_of_the_Churc,The History of the Church: From Christ to Constantine (Paperback),Eusebius,4.0,3929,324,https://i.gr-assets.com/images/S/compressed.photo.goodreads.com/books/1548094183l/483701._SY75_.jpg,religion
1255781.Have_a_Little_Fait,Have a Little Faith: a True Story (Hardcover),Mitch Albom,4.15,80863,2009,https://i.gr-assets.com/images/S/compressed.photo.goodreads.com/books/1348911800l/1255781._SX50_.jpg,religion
345500.The_Sabbat,The Sabbath: Its Meaning for Modern Man (Paperback),Abraham Joshua Heschel,4.39,4806,1951,https://i.gr-assets.com/images/S/compressed.photo.goodreads.com/books/1417605510l/345500._SY75_.jpg,religion
30858.When_God_Was_a_Woman,When God Was a Woman (Hardcover),Merlin Stone,3.86,5580,1976,https://i.gr-assets.com/images/S/compressed.photo.goodreads.com/books/1348390229l/30858._SX50_.jpg,religion
5664022,حوار مع صديقي الملحد (Paperback),مصطفى محمود,3.89,32323,1970,https://i.gr-assets.com/images/S/compressed.photo.goodreads.com/books/1304370020l/5664022._SX50_.jpg,religion
80209.Why_Christianity_Must_Change_or_Die,Why Christianity Must Change or Die: A Bishop Speaks to Believers In Exile (Paperback),John Shelby Spong,3.91,2901,1998,https://i.gr-assets.com/images/S/compressed.photo.goodreads.com/books/1435771986l/80209._SX50_.jpg,religion
26244.A_Confession,A Confession (Paperback),Leo Tolstoy,4.1,11671,1880,https://i.gr-assets.com/images/S/compressed.photo.goodreads.com/books/1348237118l/26244._SX50_.jpg,religion
15737147-help-thanks-,Help Thanks Wow: The Three Essential Prayers (Hardcover),Anne Lamott,3.95,19506,2012,https://i.gr-assets.com/images/S/compressed.photo.goodreads.com/books/1348147479l/15737147._SY75_.jpg,religion
15737147-help-thanks-,Help Thanks Wow: The Three Essential Prayers (Hardcover),Anne Lamott,3.95,19506,2012,https://i.gr-assets.com/images/S/compressed.photo.goodreads.com/books/1348147479l/15737147._SY75_.jpg,religion
821535.The_Tora,The Torah: The Five Books of Moses (Hardcover),Anonymous,4.18,1776,-500,https://i.gr-assets.com/images/S/compressed.photo.goodreads.com/books/1344673100l/821535._SY75_.jpg,religion
673655.On_the_Incarnation,On the Incarnation (Paperback),Athanasius of Alexandria,4.23,10626,318,https://i.gr-assets.com/images/S/compressed.photo.goodreads.com/books/1269974899l/673655._SX50_.jpg,religion
175113.The_Return_of_the_Prodigal_Son,The Return of the Prodigal Son: A Story of Homecoming (Paperback),Henri J.M. Nouwen,4.27,20958,1991,https://i.gr-assets.com/images/S/compressed.photo.goodreads.com/books/1327010857l/175113._SX50_.jpg,religion
29501.The_End_of_Fait,"The End of Faith: Religion, Terror, and the Future of Reason (Paperback)",Sam Harris,3.84,44395,2004,https://i.gr-assets.com/images/S/compressed.photo.goodreads.com/books/1408542906l/29501._SY75_.jpg,religion
9963483-falling-upward,Falling Upward: A Spirituality for the Two Halves of Life (Hardcover),Richard Rohr,4.16,13133,2004,https://i.gr-assets.com/images/S/compressed.photo.goodreads.com/books/1334508666l/9963483._SX50_.jpg,religion
43885149-dominion,Dominion: How the Christian Revolution Remade the World (Hardcover),Tom Holland,4.24,2845,2019,https://i.gr-assets.com/images/S/compressed.photo.goodreads.com/books/1550694436l/43885149._SY75_.jpg,religion
15015.Conversations_with_God,"Conversations with God: An Uncommon Dialogue, Book 1 (Hardcover)",Neale Donald Walsch,4.16,33996,1995,https://i.gr-assets.com/images/S/compressed.photo.goodreads.com/books/1327944254l/15015._SX50_.jpg,religion
25350.Out_of_the_Silent_Planet,"Out of the Silent Planet (The Space Trilogy, #1)",C.S. Lewis,3.91,85201,1938,https://i.gr-assets.com/images/S/compressed.photo.goodreads.com/books/1310984018l/25350._SY75_.jpg,religion
901111.Tana,Tanakh: The Holy Scriptures (Paperback),Anonymous,4.37,2925,-450,https://i.gr-assets.com/images/S/compressed.photo.goodreads.com/books/1344674999l/901111._SY75_.jpg,religion
1145854.New_Seeds_of_Contemplation,New Seeds of Contemplation (Paperback),Thomas Merton,4.15,8880,1962,https://i.gr-assets.com/images/S/compressed.photo.goodreads.com/books/1348656473l/1145854._SY75_.jpg,religion
28883.The_Lamb_s_Supper,The Lamb's Supper: The Mass as Heaven on Earth (Hardcover),Scott Hahn,4.41,7034,1999,https://i.gr-assets.com/images/S/compressed.photo.goodreads.com/books/1438209748l/28883._SX50_.jpg,religion
25709.Summa_Theologica_5_Vol,"Summa Theologica, 5 Vols (Hardcover)",Thomas Aquinas,4.13,3455,1274,https://i.gr-assets.com/images/S/compressed.photo.goodreads.com/books/1356056552l/25709._SX50_.jpg,religion
337615.Nine_Parts_of_Desire,Nine Parts of Desire: The Hidden World of Islamic Women (Paperback),Geraldine Brooks,4.04,13250,1994,https://i.gr-assets.com/images/S/compressed.photo.goodreads.com/books/1403182793l/337615._SY75_.jpg,religion
80458.The_Future_of_an_Illusion,The Future of an Illusion (Paperback),Sigmund Freud,3.77,6053,1927,https://i.gr-assets.com/images/S/compressed.photo.goodreads.com/books/1359672176l/80458._SY75_.jpg,religion
12376830-in-the-shadow-of-the-sword,In the Shadow of the Sword: The Birth of Islam and the Rise of the Global Arab Empire (Hardcover),Tom Holland,3.91,3631,2012,https://i.gr-assets.com/images/S/compressed.photo.goodreads.com/books/1333578249l/12376830._SY75_.jpg,religion
17250.The_Crucible,The Crucible (Paperback),Arthur  Miller,3.6,355201,1953,https://i.gr-assets.com/images/S/compressed.photo.goodreads.com/books/1547467608l/17250._SX50_.jpg,religion
228258.Tribulation_Force,"Tribulation Force (Left Behind, #2)",Tim LaHaye,3.94,39551,1996,https://i.gr-assets.com/images/S/compressed.photo.goodreads.com/books/1441204541l/228258._SY75_.jpg,religion
30753872-the-evangelical,The Evangelicals: The Struggle to Shape America (Hardcover),Frances FitzGerald,4.16,1448,2017,https://i.gr-assets.com/images/S/compressed.photo.goodreads.com/books/1491126129l/30753872._SY75_.jpg,religion
350.Stranger_in_a_Strange_Land,Stranger in a Strange Land (Paperback),Robert A. Heinlein,3.92,290803,1961,https://i.gr-assets.com/images/S/compressed.photo.goodreads.com/books/1156897088l/350._SY75_.jpg,religion
174845.Life_Together,Life Together: The Classic Exploration of Christian Community (Paperback),Dietrich Bonhoeffer,4.2,25859,1939,https://i.gr-assets.com/images/S/compressed.photo.goodreads.com/books/1525219497l/174845._SY75_.jpg,religion
27252.Pope_Joan,Pope Joan (Paperback),Donna Woolfolk Cross,4.07,68344,1996,https://i.gr-assets.com/images/S/compressed.photo.goodreads.com/books/1386912604l/27252._SY75_.jpg,religion
68538.Rome_Sweet_Home,Rome Sweet Home: Our Journey to Catholicism (Paperback),Scott Hahn,4.37,8036,1993,https://i.gr-assets.com/images/S/compressed.photo.goodreads.com/books/1388247686l/68538._SY75_.jpg,religion
108681.The_Cloister_Wal,The Cloister Walk (Paperback),Kathleen Norris,3.98,9525,1996,https://i.gr-assets.com/images/S/compressed.photo.goodreads.com/books/1394411228l/108681._SY75_.jpg,religion
51790.Religion_and_Science,Religion and Science (Paperback),Bertrand Russell,3.96,2856,1935,https://i.gr-assets.com/images/S/compressed.photo.goodreads.com/books/1388432494l/51790._SY75_.jpg,religion
118252.Mahabharata,Mahabharata (Paperback),C. Rajagopalachari,4.31,10236,1950,https://i.gr-assets.com/images/S/compressed.photo.goodreads.com/books/1553101923l/118252._SY75_.jpg,religion
117833.The_Master_and_Margarita,The Master and Margarita (Paperback),Mikhail Bulgakov,4.28,277536,1967,https://i.gr-assets.com/images/S/compressed.photo.goodreads.com/books/1327867963l/117833._SY75_.jpg,religion
19164.The_Divine_Comedy_of_Dante_Alighieri_Volume_2,"The Divine Comedy of Dante Alighieri, Volume 2: Purgatorio (Paperback)",Dante Alighieri,4.03,23068,1320,https://i.gr-assets.com/images/S/compressed.photo.goodreads.com/books/1348687775l/19164._SY75_.jpg,religion
51893.Thus_Spoke_Zarathustra,Thus Spoke Zarathustra (Paperback),Friedrich Nietzsche,4.05,125229,1883,https://i.gr-assets.com/images/S/compressed.photo.goodreads.com/books/1480901846l/51893._SY75_.jpg,religion
12535.Plan_B,Plan B: Further Thoughts on Faith (Paperback),Anne Lamott,4.01,21514,2004,https://i.gr-assets.com/images/S/compressed.photo.goodreads.com/books/1506548190l/12535._SY75_.jpg,religion
776.Buddhism_Plain_and_Simple,Buddhism Plain and Simple (Paperback),Steve Hagen,3.97,9319,1997,https://i.gr-assets.com/images/S/compressed.photo.goodreads.com/books/1436967616l/776._SY75_.jpg,religion
8495145-god-no-signs-you-may-already-be-an-atheist-and-other-magical-tale,"God, No! Signs You May Already Be an Atheist and Other Magical Tales (Hardcover)",Penn Jillette,3.66,7565,2011,https://i.gr-assets.com/images/S/compressed.photo.goodreads.com/books/1327935821l/8495145._SY75_.jpg,religion
214333.The_Case_for_a_Creator,The Case for a Creator: A Journalist Investigates Scientific Evidence That Points Toward God (Paperback),Lee Strobel,4.08,12568,2004,https://i.gr-assets.com/images/S/compressed.photo.goodreads.com/books/1438312193l/214333._SY75_.jpg,religion
2139442.The_Doctrine_and_Covenants_of_the_Church_of_Jesus_Christ_of_Latter_Day_Saint,The Doctrine and Covenants of the Church of Jesus Christ of Latter-Day Saints (Hardcover),The Church of Jesus Christ of Latter-day Saints,4.54,6793,1835,https://i.gr-assets.com/images/S/compressed.photo.goodreads.com/books/1348565984l/2139442._SX50_.jpg,religion
108744.Abraham,Abraham: A Journey to the Heart of Three Faiths (Paperback),Bruce Feiler,3.74,3134,2002,https://i.gr-assets.com/images/S/compressed.photo.goodreads.com/books/1407106190l/108744._SY75_.jpg,religion
8489.Muhammad,Muhammad: A Prophet for Our Time (Hardcover),Karen Armstrong,4.08,2867,2006,https://i.gr-assets.com/images/S/compressed.photo.goodreads.com/books/1438034627l/8489._SX50_.jpg,religion
23878688-the-5-love-language,The 5 Love Languages: The Secret to Love that Lasts (Kindle Edition),Gary Chapman,4.24,344647,1990,https://i.gr-assets.com/images/S/compressed.photo.goodreads.com/books/1432487272l/23878688._SY75_.jpg,religion
12321.Beyond_Good_and_Evil,Beyond Good and Evil (Paperback),Friedrich Nietzsche,3.99,79264,1886,https://i.gr-assets.com/images/S/compressed.photo.goodreads.com/books/1388607391l/12321._SY75_.jpg,religion
52397.Parable_of_the_Sower,"Parable of the Sower (Earthseed, #1)",Octavia E. Butler,4.18,99461,1993,https://i.gr-assets.com/images/S/compressed.photo.goodreads.com/books/1442169447l/52397._SY75_.jpg,religion
175141.The_Courage_to_Be,The Courage to Be (Paperback),Paul Tillich,4.1,3056,1952,https://i.gr-assets.com/images/S/compressed.photo.goodreads.com/books/1348237707l/175141._SY75_.jpg,religion
12542.Grace_Eventually_,Grace (Eventually): Thoughts on Faith,Anne Lamott,3.93,17065,2007,https://i.gr-assets.com/images/S/compressed.photo.goodreads.com/books/1442888834l/12542._SY75_.jpg,religion
179780.The_Exorcist,The Exorcist (Mass Market Paperback),William Peter Blatty,4.19,197771,1971,https://i.gr-assets.com/images/S/compressed.photo.goodreads.com/books/1375168676l/179780._SY75_.jpg,religion
27528.Nicolae,"Nicolae (Left Behind, #3)",Tim LaHaye,3.95,36184,1997,https://i.gr-assets.com/images/S/compressed.photo.goodreads.com/books/1433068715l/27528._SY75_.jpg,religion
139855.Knowing_God,Knowing God (Paperback),J.I. Packer,4.27,51340,1973,https://i.gr-assets.com/images/S/compressed.photo.goodreads.com/books/1348545196l/139855._SX50_.jpg,religion
53817.What_s_So_Amazing_About_Grace_,What's So Amazing About Grace? (Paperback),Philip Yancey,4.13,41143,1997,https://i.gr-assets.com/images/S/compressed.photo.goodreads.com/books/1328050483l/53817._SY75_.jpg,religion
76402.The_Heart_of_Christianity,The Heart of Christianity: Rediscovering a Life of Faith (Paperback),Marcus J. Borg,3.99,5662,2003,https://i.gr-assets.com/images/S/compressed.photo.goodreads.com/books/1442845004l/76402._SY75_.jpg,religion
40886652-the-standard-of-trut,"The Standard of Truth: 1815–1846 (Saints, #1)",The Church of Jesus Christ of Latter-day Saints,4.55,6877,2018,https://i.gr-assets.com/images/S/compressed.photo.goodreads.com/books/1532130372l/40886652._SX50_.jpg,religion
64081.The_Irresistible_Revolution,The Irresistible Revolution: Living as an Ordinary Radical (Paperback),Shane Claiborne,3.99,25395,2006,https://i.gr-assets.com/images/S/compressed.photo.goodreads.com/books/1432916833l/64081._SX50_.jpg,religion
11507.My_Name_Is_Asher_Lev,My Name Is Asher Lev (Paperback),Chaim Potok,4.22,37604,1972,https://i.gr-assets.com/images/S/compressed.photo.goodreads.com/books/1385056726l/11507._SY75_.jpg,religion
11346463-beyond-religion,Beyond Religion: Ethics for a Whole World (Hardcover),Dalai Lama XIV,3.96,6099,2011,https://i.gr-assets.com/images/S/compressed.photo.goodreads.com/books/1631356574l/11346463._SY75_.jpg,religion
10210552-absolute-monarc,Absolute Monarchs: A History of the Papacy (Hardcover),John Julius Norwich,3.7,2900,2011,https://i.gr-assets.com/images/S/compressed.photo.goodreads.com/books/1348642436l/10210552._SX50_.jpg,religion
82405.Jesus_of_Nazaret,Jesus of Nazareth: From the Baptism in the Jordan to the Transfiguration (Hardcover),Benedict XVI,4.4,5466,2007,https://i.gr-assets.com/images/S/compressed.photo.goodreads.com/books/1442015549l/82405._SY75_.jpg,religion
372623.Rescuing_the_Bible_from_Fundamentalism,Rescuing the Bible from Fundamentalism: A Bishop Rethinks the Meaning of Scripture (Paperback),John Shelby Spong,4.02,2150,1991,https://i.gr-assets.com/images/S/compressed.photo.goodreads.com/books/1442637962l/372623._SY75_.jpg,religion
463877.The_Rig_Veda,The Rig Veda (Paperback),Wendy Doniger,3.91,1213,-1000,https://i.gr-assets.com/images/S/compressed.photo.goodreads.com/books/1311645824l/463877._SY75_.jpg,religion
23281637-faith-versus-fact,Faith Versus Fact: Why Science and Religion are Incompatible (Hardcover),Jerry A. Coyne,4.13,1561,2015,https://i.gr-assets.com/images/S/compressed.photo.goodreads.com/books/1412532512l/23281637._SY75_.jpg,religion
69094.Simply_Christian,Simply Christian: Why Christianity Makes Sense (Hardcover),N.T. Wright,3.99,10023,2006,https://i.gr-assets.com/images/S/compressed.photo.goodreads.com/books/1386924444l/69094._SY75_.jpg,religion
25332115-the-sound-of-gravel,The Sound of Gravel (Hardcover),Ruth Wariner,4.25,38475,2016,https://i.gr-assets.com/images/S/compressed.photo.goodreads.com/books/1436200674l/25332115._SY75_.jpg,religion
6371553-the-book-of-genesi,The Book of Genesis (Hardcover),Robert Crumb,4.02,4921,2009,https://i.gr-assets.com/images/S/compressed.photo.goodreads.com/books/1327880600l/6371553._SX50_.jpg,religion
199065.No_Man_Knows_My_History,No Man Knows My History: The Life of Joseph Smith (Paperback),Fawn M. Brodie,4.11,2716,1945,https://i.gr-assets.com/images/S/compressed.photo.goodreads.com/books/1462266491l/199065._SY75_.jpg,religion
66485.The_Crisis_of_Islam,The Crisis of Islam: Holy War and Unholy Terror (Paperback),Bernard Lewis,3.7,3107,2003,https://i.gr-assets.com/images/S/compressed.photo.goodreads.com/books/1388256749l/66485._SY75_.jpg,religion
27202.The_Gifts_of_the_Je,The Gifts of the Jews: How a Tribe of Desert Nomads Changed the Way Everyone Thinks and Feels (Paperback),Thomas Cahill,3.87,4443,1998,https://i.gr-assets.com/images/S/compressed.photo.goodreads.com/books/1347364365l/27202._SY75_.jpg,religion
3577033-good-,"Good Book: The Bizarre, Hilarious, Disturbing, Marvelous, and Inspiring Things I Learned When I Read Every Single Word of the Bible (Paperback)",David Plotz,3.8,1510,2009,https://i.gr-assets.com/images/S/compressed.photo.goodreads.com/books/1349112041l/3577033._SX50_.jpg,religion
554986.The_Family,The Family: The Secret Fundamentalism at the Heart of American Power (Hardcover),Jeff Sharlet,3.78,3331,2007,https://i.gr-assets.com/images/S/compressed.photo.goodreads.com/books/1370307953l/554986._SY75_.jpg,religion
5131.The_Perennial_Philosophy,The Perennial Philosophy (Paperback),Aldous Huxley,4.01,6233,1944,https://i.gr-assets.com/images/S/compressed.photo.goodreads.com/books/1375947411l/5131._SY75_.jpg,religion
99007.Jewish_Literacy,"Jewish Literacy: The Most Important Things to Know about the Jewish Religion, Its People, and Its History (Hardcover)",Joseph Telushkin,4.3,2079,1991,https://i.gr-assets.com/images/S/compressed.photo.goodreads.com/books/1439689267l/99007._SY75_.jpg,religion
141152.Ramayana,Ramayana (Paperback),Vālmīki,4.14,9359,-400,https://i.gr-assets.com/images/S/compressed.photo.goodreads.com/books/1408604828l/141152._SY75_.jpg,religion
20262405-the-bible-tells-me-,The Bible Tells Me So: Why Defending Scripture Has Made Us Unable to Read It (Hardcover),Peter Enns,4.22,4280,2014,https://i.gr-assets.com/images/S/compressed.photo.goodreads.com/books/1407711405l/20262405._SY75_.jpg,religion
