Id,Title,Author,Average Rating,Number of ratings,Year of publishing,Url of image,Genre
14743.The_God_Delusion,The God Delusion (Hardcover),Richard Dawkins,3.89,254252,2006,https://i.gr-assets.com/images/S/compressed.photo.goodreads.com/books/1347220693l/14743._SY75_.jpg,religion
40792344-mere-christianity,Mere Christianity (Kindle Edition),C.S. Lewis,4.32,338908,1942,https://i.gr-assets.com/images/S/compressed.photo.goodreads.com/books/1531409863l/40792344._SX50_.jpg,religion
43369.God_Is_Not_Great,God Is Not Great: How Religion Poisons Everything (Hardcover),Christopher Hitchens,3.93,101901,2007,https://i.gr-assets.com/images/S/compressed.photo.goodreads.com/books/1411218313l/43369._SY75_.jpg,religion
8130077-the-screwtape-letter,The Screwtape Letters (Kindle Edition),C.S. Lewis,4.23,369632,1942,https://i.gr-assets.com/images/S/compressed.photo.goodreads.com/books/1476379778l/8130077._SY75_.jpg,religion
3873.A_History_of_God,"A History of God: The 4,000-Year Quest of Judaism, Christianity, and Islam (Hardcover)",Karen Armstrong,3.86,47192,1993,https://i.gr-assets.com/images/S/compressed.photo.goodreads.com/books/1386924363l/3873._SX50_.jpg,religion
1923820.The_Holy_Bible,The Holy Bible: King James Version (Hardcover),Anonymous,4.4,243134,1611,https://i.gr-assets.com/images/S/compressed.photo.goodreads.com/books/1631816305l/1923820._SY75_.jpg,religion
646462._,القرآن الكريم (Hardcover),Anonymous,4.36,61268,632,https://i.gr-assets.com/images/S/compressed.photo.goodreads.com/books/1275263838l/646462._SY75_.jpg,religion
17568801-zealot,Zealot: The Life and Times of Jesus of Nazareth (Hardcover),Reza Aslan,3.82,68885,2013,https://i.gr-assets.com/images/S/compressed.photo.goodreads.com/books/1367929567l/17568801._SY75_.jpg,religion
10847.Under_the_Banner_of_Heaven,Under the Banner of Heaven: A Story of Violent Faith (Paperback),Jon Krakauer,3.98,174232,2003,https://i.gr-assets.com/images/S/compressed.photo.goodreads.com/books/1356441391l/10847._SY75_.jpg,religion
52036.Siddhartha,Siddhartha (Mass Market Paperback),Hermann Hesse,4.04,647240,1922,https://i.gr-assets.com/images/S/compressed.photo.goodreads.com/books/1629378189l/52036._SY75_.jpg,religion
67896.Tao_Te_Ching,Tao Te Ching (Paperback),Lao Tzu,4.26,136390,-600,https://i.gr-assets.com/images/S/compressed.photo.goodreads.com/books/1333578861l/67896._SY75_.jpg,religion
99944.The_Bhagavad_Gita,The Bhagavad Gita (Paperback),Krishna-Dwaipayana Vyasa,4.14,60360,-400,https://i.gr-assets.com/images/S/compressed.photo.goodreads.com/books/1631634958l/99944._SX50_.jpg,religion
27037.Confession,Confessions (Paperback),Augustine of Hippo,3.89,57610,400,https://i.gr-assets.com/images/S/compressed.photo.goodreads.com/books/1266454051l/27037._SY75_.jpg,religion
51364.Misquoting_Jesu,Misquoting Jesus: The Story Behind Who Changed the Bible and Why (Paperback),Bart D. Ehrman,3.87,17133,2005,https://i.gr-assets.com/images/S/compressed.photo.goodreads.com/books/1407109431l/51364._SY75_.jpg,religion
51299.Letter_to_a_Christian_Nation,Letter to a Christian Nation (Hardcover),Sam Harris,3.99,39002,2006,https://i.gr-assets.com/images/S/compressed.photo.goodreads.com/books/1385089375l/51299._SY75_.jpg,religion
29501.The_End_of_Fait,"The End of Faith: Religion, Terror, and the Future of Reason (Paperback)",Sam Harris,3.84,44395,2004,https://i.gr-assets.com/images/S/compressed.photo.goodreads.com/books/1408542906l/29501._SY75_.jpg,religion
323355.The_Book_of_Mormon,The Book of Mormon: Another Testament of Jesus Christ (Paperback),Anonymous,4.29,79553,1830,https://i.gr-assets.com/images/S/compressed.photo.goodreads.com/books/1327389004l/323355._SX50_.jpg,religion
40411388-no-god-but-god,"No God but God: The Origins, Evolution and Future of Islam (Kindle Edition)",Reza Aslan,4.09,25686,2005,https://i.gr-assets.com/images/S/compressed.photo.goodreads.com/books/1528328757l/40411388._SY75_.jpg,religion
25845273-the-great-divorce,The Great Divorce (Paperback),C.S. Lewis,4.28,121883,1945,https://i.gr-assets.com/images/S/compressed.photo.goodreads.com/books/1435968645l/25845273._SX50_.jpg,religion
40874325-the-shac,The Shack (Kindle Edition),William Paul Young,3.79,582426,2007,https://i.gr-assets.com/images/S/compressed.photo.goodreads.com/books/1532013572l/40874325._SY75_.jpg,religion
495395.The_Year_of_Living_Biblically,The Year of Living Biblically: One Man's Humble Quest to Follow the Bible as Literally as Possible (Hardcover),A.J. Jacobs,3.74,69781,2007,https://i.gr-assets.com/images/S/compressed.photo.goodreads.com/books/1327977486l/495395._SY75_.jpg,religion
16142053-going-clear,"Going Clear: Scientology, Hollywood, and the Prison of Belief (Hardcover)",Lawrence Wright,4.02,41924,2013,https://i.gr-assets.com/images/S/compressed.photo.goodreads.com/books/1358119149l/16142053._SX50_.jpg,religion
968.The_Da_Vinci_Code,"The Da Vinci Code (Robert Langdon, #2)",Dan Brown,3.88,2095485,2003,https://i.gr-assets.com/images/S/compressed.photo.goodreads.com/books/1579621267l/968._SY75_.jpg,religion
28820.The_Varieties_of_Religious_Experience,The Varieties of Religious Experience (Paperback),William  James,3.95,12303,1901,https://i.gr-assets.com/images/S/compressed.photo.goodreads.com/books/1167956957l/28820._SX50_.jpg,religion
35133922-educated,Educated (Hardcover),Tara Westover,4.46,1055491,2018,https://i.gr-assets.com/images/S/compressed.photo.goodreads.com/books/1506026635l/35133922._SY75_.jpg,religion
110763.The_Gnostic_Gospel,The Gnostic Gospels (Paperback),Elaine Pagels,3.9,17353,1979,https://i.gr-assets.com/images/S/compressed.photo.goodreads.com/books/1403187711l/110763._SY75_.jpg,religion
472025.Why_I_Am_Not_a_Christian_and_Other_Essays_on_Religion_and_Related_Subject,Why I Am Not a Christian and Other Essays on Religion and Related Subjects (Paperback),Bertrand Russell,4.02,19402,1957,https://i.gr-assets.com/images/S/compressed.photo.goodreads.com/books/1347925703l/472025._SY75_.jpg,religion
4989.The_Red_Tent,The Red Tent (Hardcover),Anita Diamant,4.18,550112,1997,https://i.gr-assets.com/images/S/compressed.photo.goodreads.com/books/1405739117l/4989._SY75_.jpg,religion
15997.Paradise_Lost,Paradise Lost (Paperback),John Milton,3.81,151899,1667,https://i.gr-assets.com/images/S/compressed.photo.goodreads.com/books/1526070678l/15997._SY75_.jpg,religion
159964.The_Dhammapada,The Dhammapada (Paperback),Anonymous,4.24,26108,-400,https://i.gr-assets.com/images/S/compressed.photo.goodreads.com/books/1442577801l/159964._SY75_.jpg,religion
29797.The_Pilgrim_s_Progre,The Pilgrim's Progress (Paperback),John Bunyan,3.99,121770,1684,https://i.gr-assets.com/images/S/compressed.photo.goodreads.com/books/1405982367l/29797._SY75_.jpg,religion
10285.The_World_s_Religion,The World's Religions (Paperback),Huston Smith,3.99,13072,1958,https://i.gr-assets.com/images/S/compressed.photo.goodreads.com/books/1385166652l/10285._SY75_.jpg,religion
28881.Lam,"Lamb: The Gospel According to Biff, Christ's Childhood Pal (Paperback)",Christopher Moore,4.2,166558,2002,https://i.gr-assets.com/images/S/compressed.photo.goodreads.com/books/1331419009l/28881._SY75_.jpg,religion
1566053.The_Portable_Atheist,The Portable Atheist: Essential Readings for the Nonbeliever (Paperback),Christopher Hitchens,4.02,17618,2007,https://i.gr-assets.com/images/S/compressed.photo.goodreads.com/books/1435405001l/1566053._SY75_.jpg,religion
960.Angels_Demon,"Angels & Demons (Robert Langdon, #1)",Dan Brown,3.92,2883297,2000,https://i.gr-assets.com/images/S/compressed.photo.goodreads.com/books/1630637257l/960._SX50_.jpg,religion
11324722-the-righteous-mind,The Righteous Mind: Why Good People Are Divided by Politics and Religion (Hardcover),Jonathan Haidt,4.18,44216,2012,https://i.gr-assets.com/images/S/compressed.photo.goodreads.com/books/1534528902l/11324722._SY75_.jpg,religion
13650513-the-problem-of-pain,The Problem of Pain (Paperback),C.S. Lewis,4.08,54011,1940,https://i.gr-assets.com/images/S/compressed.photo.goodreads.com/books/1504348728l/13650513._SY75_.jpg,religion
6340873-the-evolution-of-god,The Evolution of God (Hardcover),Robert Wright,3.94,7071,2009,https://i.gr-assets.com/images/S/compressed.photo.goodreads.com/books/1442044016l/6340873._SY75_.jpg,religion
81227.Infidel,Infidel (Hardcover),Ayaan Hirsi Ali,4.13,92896,2006,https://i.gr-assets.com/images/S/compressed.photo.goodreads.com/books/1388256729l/81227._SY75_.jpg,religion
87665.Orthodoxy,Orthodoxy (Paperback),G.K. Chesterton,4.13,35071,1908,https://i.gr-assets.com/images/S/compressed.photo.goodreads.com/books/1348323220l/87665._SY75_.jpg,religion
6101996-jesus-interrupted,"Jesus, Interrupted: Revealing the Hidden Contradictions in the Bible & Why We Don't Know About Them (Hardcover)",Bart D. Ehrman,3.96,8731,2009,https://i.gr-assets.com/images/S/compressed.photo.goodreads.com/books/1348078937l/6101996._SX50_.jpg,religion
15645.Infern,Inferno (Paperback),Dante Alighieri,4.0,157177,1320,https://i.gr-assets.com/images/S/compressed.photo.goodreads.com/books/1520255019l/15645._SY75_.jpg,religion
2547.The_Prophet,The Prophet (Paperback),Kahlil Gibran,4.21,261179,1923,https://i.gr-assets.com/images/S/compressed.photo.goodreads.com/books/1355046521l/2547._SY75_.jpg,religion
73186.The_Case_for_Christ,The Case for Christ (Paperback),Lee Strobel,4.16,111900,1998,https://i.gr-assets.com/images/S/compressed.photo.goodreads.com/books/1448776489l/73186._SY75_.jpg,religion
56495.The_Purpose_Driven_Life,The Purpose Driven Life: What on Earth Am I Here for? (Paperback),Rick Warren,3.95,249400,2002,https://i.gr-assets.com/images/S/compressed.photo.goodreads.com/books/1440111652l/56495._SY75_.jpg,religion
4214.Life_of_Pi,Life of Pi (Paperback),Yann Martel,3.92,1443865,2001,https://i.gr-assets.com/images/S/compressed.photo.goodreads.com/books/1631251689l/4214._SY75_.jpg,religion
12067.Good_Omen,"Good Omens: The Nice and Accurate Prophecies of Agnes Nutter, Witch (Mass Market Paperback)",Terry Pratchett,4.23,615007,1990,https://i.gr-assets.com/images/S/compressed.photo.goodreads.com/books/1615552073l/12067._SY75_.jpg,religion
6656.The_Divine_Comedy,The Divine Comedy (Hardcover),Dante Alighieri,4.04,135602,1320,https://i.gr-assets.com/images/S/compressed.photo.goodreads.com/books/1624535952l/6656._SY75_.jpg,religion
6957725-a-history-of-christianity,A History of Christianity: The First Three Thousand Years (Hardcover),Diarmaid MacCulloch,4.11,5465,2009,https://i.gr-assets.com/images/S/compressed.photo.goodreads.com/books/1348906986l/6957725._SY75_.jpg,religion
7214.Blue_Like_Jazz,Blue Like Jazz: Nonreligious Thoughts on Christian Spirituality (Paperback),Donald Miller,3.89,112173,2003,https://i.gr-assets.com/images/S/compressed.photo.goodreads.com/books/1531261584l/7214._SY75_.jpg,religion
2067.Breaking_the_Spell,Breaking the Spell: Religion as a Natural Phenomenon (Hardcover),Daniel C. Dennett,3.89,11951,2006,https://i.gr-assets.com/images/S/compressed.photo.goodreads.com/books/1406403613l/2067._SY75_.jpg,religion
26077627-a-grief-observed,A Grief Observed (Paperback),C.S. Lewis,4.16,68516,1961,https://i.gr-assets.com/images/S/compressed.photo.goodreads.com/books/1439250484l/26077627._SX50_.jpg,religion
48757.The_Tao_of_P,The Tao of Pooh (Paperback),Benjamin Hoff,3.98,111686,1982,https://i.gr-assets.com/images/S/compressed.photo.goodreads.com/books/1348137748l/48757._SY75_.jpg,religion
7933292-heaven-is-for-real,Heaven is for Real: A Little Boy's Astounding Story of His Trip to Heaven and Back (Paperback),Todd Burpo,4.0,297166,2010,https://i.gr-assets.com/images/S/compressed.photo.goodreads.com/books/1348467278l/7933292._SY75_.jpg,religion
280111.Holy_Bible,Holy Bible: New International Version (Hardcover),Anonymous,4.57,70948,1973,https://i.gr-assets.com/images/S/compressed.photo.goodreads.com/books/1631965680l/280111._SY75_.jpg,religion
1858013.The_Reason_for_God,The Reason for God: Belief in an Age of Skepticism (Hardcover),Timothy J. Keller,4.17,58227,2008,https://i.gr-assets.com/images/S/compressed.photo.goodreads.com/books/1388185497l/1858013._SX50_.jpg,religion
100915.The_Lion_the_Witch_and_the_Wardrobe,"The Lion, the Witch and the Wardrobe (Chronicles of Narnia, #1)",C.S. Lewis,4.22,2355406,1950,https://i.gr-assets.com/images/S/compressed.photo.goodreads.com/books/1353029077l/100915._SY75_.jpg,religion
290882.The_Upanishad,The Upanishads (Paperback),Anonymous,4.17,15041,-500,https://i.gr-assets.com/images/S/compressed.photo.goodreads.com/books/1327881361l/290882._SY75_.jpg,religion
35519.The_Power_of_Myt,The Power of Myth (Paperback),Joseph Campbell,4.23,49639,1988,https://i.gr-assets.com/images/S/compressed.photo.goodreads.com/books/1327878742l/35519._SY75_.jpg,religion
29938407-the-four-love,The Four Loves (Paperback),C.S. Lewis,4.12,50055,1960,https://i.gr-assets.com/images/S/compressed.photo.goodreads.com/books/1483646226l/29938407._SY75_.jpg,religion
7244.The_Poisonwood_Bible,The Poisonwood Bible (Hardcover),Barbara Kingsolver,4.07,689275,1998,https://i.gr-assets.com/images/S/compressed.photo.goodreads.com/books/1412242487l/7244._SY75_.jpg,religion
6359293-the-case-for-god,The Case for God (Hardcover),Karen Armstrong,3.79,9599,2001,https://i.gr-assets.com/images/S/compressed.photo.goodreads.com/books/1320462485l/6359293._SX50_.jpg,religion
27309.The_Battle_for_God,The Battle for God: A History of Fundamentalism (Paperback),Karen Armstrong,3.94,6308,2000,https://i.gr-assets.com/images/S/compressed.photo.goodreads.com/books/1388197300l/27309._SY75_.jpg,religion
25673.City_of_God,City of God (Paperback),Augustine of Hippo,3.87,11711,426,https://i.gr-assets.com/images/S/compressed.photo.goodreads.com/books/1539435514l/25673._SY75_.jpg,religion
27306.Islam,Islam: A Short History (Paperback),Karen Armstrong,4.04,9425,2000,https://i.gr-assets.com/images/S/compressed.photo.goodreads.com/books/1403181902l/27306._SY75_.jpg,religion
22470.The_Origin_of_Satan,"The Origin of Satan: How Christians Demonized Jews, Pagans and Heretics (Paperback)",Elaine Pagels,3.91,6435,1995,https://i.gr-assets.com/images/S/compressed.photo.goodreads.com/books/1403170219l/22470._SY75_.jpg,religion
18774981-waking-up,Waking Up: A Guide to Spirituality Without Religion (Hardcover),Sam Harris,3.89,39884,2014,https://i.gr-assets.com/images/S/compressed.photo.goodreads.com/books/1415677308l/18774981._SY75_.jpg,religion
851393.The_Imitation_of_Christ,The Imitation of Christ (Paperback),Thomas à Kempis,4.12,22318,1427,https://i.gr-assets.com/images/S/compressed.photo.goodreads.com/books/1320442968l/851393._SY75_.jpg,religion
28024.The_Sacred_and_the_Profane,The Sacred and the Profane: The Nature of Religion (Paperback),Mircea Eliade,4.1,7067,1956,https://i.gr-assets.com/images/S/compressed.photo.goodreads.com/books/1309228014l/28024._SY75_.jpg,religion
481749.Jesus_the_Christ,"Jesus the Christ: A Study of the Messiah and His Mission According to Holy Scriptures, Both Ancient and Modern (Hardcover)",James E. Talmage,4.62,22045,1915,https://i.gr-assets.com/images/S/compressed.photo.goodreads.com/books/1202623375l/481749._SY75_.jpg,religion
38447.The_Handmaid_s_Tale,"The Handmaid's Tale (The Handmaid's Tale, #1)",Margaret Atwood,4.12,1659830,1985,https://i.gr-assets.com/images/S/compressed.photo.goodreads.com/books/1578028274l/38447._SY75_.jpg,religion
175078.The_Seven_Storey_Mountain,The Seven Storey Mountain (Paperback),Thomas Merton,3.96,20387,1948,https://i.gr-assets.com/images/S/compressed.photo.goodreads.com/books/1347432281l/175078._SY75_.jpg,religion
53982.The_Great_Transformation,The Great Transformation: The Beginning of Our Religious Traditions (Paperback),Karen Armstrong,4.03,3624,2006,https://i.gr-assets.com/images/S/compressed.photo.goodreads.com/books/1388191476l/53982._SY75_.jpg,religion
30165203-american-god,"American Gods (American Gods, #1)",Neil Gaiman,4.1,827589,2001,https://i.gr-assets.com/images/S/compressed.photo.goodreads.com/books/1462924585l/30165203._SY75_.jpg,religion
334176.The_Sparr,"The Sparrow (The Sparrow, #1)",Mary Doria Russell,4.1,72359,1996,https://i.gr-assets.com/images/S/compressed.photo.goodreads.com/books/1230829367l/334176._SY75_.jpg,religion
38210.The_Art_of_Happine,The Art of Happiness (Hardcover),Dalai Lama XIV,4.14,105517,1998,https://i.gr-assets.com/images/S/compressed.photo.goodreads.com/books/1309287434l/38210._SX50_.jpg,religion
20149192-how-jesus-became-god,How Jesus Became God: The Exaltation of a Jewish Preacher from Galilee (Hardcover),Bart D. Ehrman,4.04,4685,2014,https://i.gr-assets.com/images/S/compressed.photo.goodreads.com/books/1387743291l/20149192._SY75_.jpg,religion
68210.Gilead,Gilead (Paperback),Marilynne Robinson,3.83,98510,2004,https://i.gr-assets.com/images/S/compressed.photo.goodreads.com/books/1558681761l/68210._SY75_.jpg,religion
119073.The_Name_of_the_Rose,The Name of the Rose (Paperback),Umberto Eco,4.13,330050,1980,https://i.gr-assets.com/images/S/compressed.photo.goodreads.com/books/1415375471l/119073._SY75_.jpg,religion
174834.The_Cost_of_Discipleship,The Cost of Discipleship (Paperback),Dietrich Bonhoeffer,4.25,40196,1937,https://i.gr-assets.com/images/S/compressed.photo.goodreads.com/books/1348281510l/174834._SY75_.jpg,religion
121732.Surprised_by_Joy,Surprised by Joy: The Shape of My Early Life (Paperback),C.S. Lewis,4.01,60217,1955,https://i.gr-assets.com/images/S/compressed.photo.goodreads.com/books/1381407473l/121732._SY75_.jpg,religion
43372.The_Missionary_Position,The Missionary Position: Mother Teresa in Theory and Practice (Paperback),Christopher Hitchens,4.07,9932,1995,https://i.gr-assets.com/images/S/compressed.photo.goodreads.com/books/1435813400l/43372._SY75_.jpg,religion
588138.The_Hero_With_a_Thousand_Face,The Hero With a Thousand Faces (Paperback),Joseph Campbell,4.12,38282,1949,https://i.gr-assets.com/images/S/compressed.photo.goodreads.com/books/1442885694l/588138._SY75_.jpg,religion
10890.Traveling_Mercie,Traveling Mercies: Some Thoughts on Faith (Paperback),Anne Lamott,4.09,47949,1999,https://i.gr-assets.com/images/S/compressed.photo.goodreads.com/books/1403182174l/10890._SY75_.jpg,religion
402843.Zen_Mind_Beginner_s_Mind,"Zen Mind, Beginner's Mind: Informal Talks on Zen Meditation and Practice (Paperback)",Shunryu Suzuki,4.18,41536,1970,https://i.gr-assets.com/images/S/compressed.photo.goodreads.com/books/1392992935l/402843._SY75_.jpg,religion
15827066-beyond-belief,Beyond Belief: My Secret Life Inside Scientology and My Harrowing Escape (Hardcover),Jenna Miscavige Hill,3.72,39866,2013,https://i.gr-assets.com/images/S/compressed.photo.goodreads.com/books/1354001608l/15827066._SY75_.jpg,religion
12576334-religion-for-atheist,Religion for Atheists: A Non-Believer's Guide to the Uses of Religion  (Hardcover),Alain de Botton,3.63,11190,2011,https://i.gr-assets.com/images/S/compressed.photo.goodreads.com/books/1327225900l/12576334._SY75_.jpg,religion
35506.The_Language_of_God,The Language of God: A Scientist Presents Evidence for Belief (Hardcover),Francis S. Collins,3.78,12438,2006,https://i.gr-assets.com/images/S/compressed.photo.goodreads.com/books/1441384423l/35506._SY75_.jpg,religion
18144590-the-alchemist,The Alchemist (Paperback),Paulo Coelho,3.89,2401370,1988,https://i.gr-assets.com/images/S/compressed.photo.goodreads.com/books/1466865542l/18144590._SY75_.jpg,religion
13547241-unorthodox,Unorthodox: The Scandalous Rejection of My Hasidic Roots (Paperback),Deborah Feldman,3.96,51771,2012,https://i.gr-assets.com/images/S/compressed.photo.goodreads.com/books/1336676500l/13547241._SY75_.jpg,religion
107273.Lost_Christianitie,Lost Christianities: The Battles for Scripture and the Faiths We Never Knew (Paperback),Bart D. Ehrman,4.05,5527,2002,https://i.gr-assets.com/images/S/compressed.photo.goodreads.com/books/1477449180l/107273._SY75_.jpg,religion
7655375-god-is-not-one,God Is Not One: The Eight Rival Religions That Run the World--and Why Their Differences Matter (Hardcover),Stephen R. Prothero,3.76,3392,2010,https://i.gr-assets.com/images/S/compressed.photo.goodreads.com/books/1347507888l/7655375._SY75_.jpg,religion
17349.The_Demon_Haunted_World,The Demon-Haunted World: Science as a Candle in the Dark (Paperback),Carl Sagan,4.26,65943,1996,https://i.gr-assets.com/images/S/compressed.photo.goodreads.com/books/1553691804l/17349._SX50_.jpg,religion
119322.The_Golden_Compa,"The Golden Compass (His Dark Materials, #1)",Philip Pullman,4.0,1384709,1995,https://i.gr-assets.com/images/S/compressed.photo.goodreads.com/books/1505766203l/119322._SX50_.jpg,religion
27523.Left_Behind,"Left Behind (Left Behind, #1)",Tim LaHaye,3.83,215940,1995,https://i.gr-assets.com/images/S/compressed.photo.goodreads.com/books/1406505054l/27523._SY75_.jpg,religion
3206011-crazy-love,Crazy Love: Overwhelmed by a Relentless God (Paperback),Francis Chan,4.15,162986,2008,https://i.gr-assets.com/images/S/compressed.photo.goodreads.com/books/1328763220l/3206011._SY75_.jpg,religion
25151238-islam-and-the-future-of-tolerance,Islam and the Future of Tolerance: A Dialogue (Hardcover),Sam Harris,4.05,6604,2015,https://i.gr-assets.com/images/S/compressed.photo.goodreads.com/books/1600502885l/25151238._SY75_.jpg,religion
40721873-love-win,"Love Wins: A Book About Heaven, Hell, and the Fate of Every Person Who Ever Lived (Kindle Edition)",Rob Bell,3.61,27427,2011,https://i.gr-assets.com/images/S/compressed.photo.goodreads.com/books/1530748785l/40721873._SY75_.jpg,religion
73184.Living_Buddha_Living_Christ,"Living Buddha, Living Christ (Paperback)",Thich Nhat Hanh,4.09,16991,1997,https://i.gr-assets.com/images/S/compressed.photo.goodreads.com/books/1309211729l/73184._SY75_.jpg,religion
1976714.God_s_Problem,God's Problem: How the Bible Fails to Answer Our Most Important Question - Why We Suffer (Hardcover),Bart D. Ehrman,3.93,5271,2008,https://i.gr-assets.com/images/S/compressed.photo.goodreads.com/books/1348084856l/1976714._SY75_.jpg,religion
24965.Fear_and_Trembling,Fear and Trembling (Paperback),Søren Kierkegaard,4.0,21280,1843,https://i.gr-assets.com/images/S/compressed.photo.goodreads.com/books/1309286516l/24965._SY75_.jpg,religion
37903770-norse-mythology,Norse Mythology (Paperback),Neil Gaiman,4.08,261897,2017,https://i.gr-assets.com/images/S/compressed.photo.goodreads.com/books/1516128292l/37903770._SX50_.jpg,religion
386559.Beyond_Belief,Beyond Belief: The Secret Gospel of Thomas (Hardcover),Elaine Pagels,3.83,7783,2003,https://i.gr-assets.com/images/S/compressed.photo.goodreads.com/books/1388201807l/386559._SY75_.jpg,religion
34101725-god,God: A Human History (Kindle Edition),Reza Aslan,3.99,6031,2017,https://i.gr-assets.com/images/S/compressed.photo.goodreads.com/books/1513258307l/34101725._SY75_.jpg,religion
3525894-the-unlikely-disciple,The Unlikely Disciple: A Sinner's Semester at America's Holiest University (Hardcover),Kevin Roose,3.97,11686,2009,https://i.gr-assets.com/images/S/compressed.photo.goodreads.com/books/1442763542l/3525894._SY75_.jpg,religion
22574709-searching-for-sunday,"Searching for Sunday: Loving, Leaving, and Finding the Church (Paperback)",Rachel Held Evans,4.12,20081,2015,https://i.gr-assets.com/images/S/compressed.photo.goodreads.com/books/1404480530l/22574709._SY75_.jpg,religion
25825420-the-abolition-of-man,The Abolition of Man (Paperback),C.S. Lewis,4.04,27991,1943,https://i.gr-assets.com/images/S/compressed.photo.goodreads.com/books/1435685201l/25825420._SY75_.jpg,religion
4069.Man_s_Search_for_Meaning,Man's Search for Meaning (Paperback),Viktor E. Frankl,4.35,508633,1946,https://i.gr-assets.com/images/S/compressed.photo.goodreads.com/books/1535419394l/4069._SY75_.jpg,religion
818811.Escape,Escape (Hardcover),Carolyn Jessop,3.91,45500,2007,https://i.gr-assets.com/images/S/compressed.photo.goodreads.com/books/1442640131l/818811._SY75_.jpg,religion
25200.Silence,Silence (Paperback),Shūsaku Endō,4.06,28192,1966,https://i.gr-assets.com/images/S/compressed.photo.goodreads.com/books/1503294393l/25200._SY75_.jpg,religion
8713068-forged,Forged: Writing in the Name of God (Hardcover),Bart D. Ehrman,4.0,3001,2011,https://i.gr-assets.com/images/S/compressed.photo.goodreads.com/books/1312394806l/8713068._SY75_.jpg,religion
7785194-the-moral-landscape,The Moral Landscape: How Science Can Determine Human Values (Hardcover),Sam Harris,3.91,21379,2010,https://i.gr-assets.com/images/S/compressed.photo.goodreads.com/books/1331317058l/7785194._SY75_.jpg,religion
102104.Who_Wrote_the_Bible_,Who Wrote the Bible? (Paperback),Richard Elliott Friedman,4.1,5551,1987,https://i.gr-assets.com/images/S/compressed.photo.goodreads.com/books/1347325474l/102104._SY75_.jpg,religion
18122.The_Amber_Spygla,"The Amber Spyglass (His Dark Materials, #3)",Philip Pullman,4.08,331767,2000,https://i.gr-assets.com/images/S/compressed.photo.goodreads.com/books/1329189152l/18122._SY75_.jpg,religion
408862.The_Golden_Boug,The Golden Bough (Paperback),James George Frazer,4.03,8279,1890,https://i.gr-assets.com/images/S/compressed.photo.goodreads.com/books/1174504446l/408862._SY75_.jpg,religion
4934.The_Brothers_Karamazov,The Brothers Karamazov (Paperback),Fyodor Dostoevsky,4.32,272025,1879,https://i.gr-assets.com/images/S/compressed.photo.goodreads.com/books/1427728126l/4934._SX50_.jpg,religion
26827675-troublemaker,Troublemaker: Surviving Hollywood and Scientology (Hardcover),Leah Remini,4.0,63987,2015,https://i.gr-assets.com/images/S/compressed.photo.goodreads.com/books/1491248986l/26827675._SY75_.jpg,religion
110795.Catechism_of_the_Catholic_Churc,Catechism of the Catholic Church (Paperback),The Catholic Church,4.43,9409,1992,https://i.gr-assets.com/images/S/compressed.photo.goodreads.com/books/1320474441l/110795._SY75_.jpg,religion
12781.The_Satanic_Verse,The Satanic Verses (Paperback),Salman Rushdie,3.7,60401,1988,https://i.gr-assets.com/images/S/compressed.photo.goodreads.com/books/1281988101l/12781._SX50_.jpg,religion
