Id,Title,Author,Average Rating,Number of ratings,Year of publishing,Url of image,Genre
760019.Letters_and_Papers_from_Prison,Letters and Papers from Prison (Paperback),Dietrich Bonhoeffer,4.31,3301,1951,https://i.gr-assets.com/images/S/compressed.photo.goodreads.com/books/1344664296l/760019._SX50_.jpg,religion
28021.A_History_of_Religious_Ideas_Volume_3,"A History of Religious Ideas, Volume 3: From Muhammad to the Age of Reforms (Paperback)",Mircea Eliade,4.45,630,1983,https://i.gr-assets.com/images/S/compressed.photo.goodreads.com/books/1388801915l/28021._SY75_.jpg,religion
163362.My_Life_with_the_Saint,My Life with the Saints (Hardcover),James     Martin,4.07,5816,2006,https://i.gr-assets.com/images/S/compressed.photo.goodreads.com/books/1347221358l/163362._SX50_.jpg,religion
545951.Death_Comes_for_the_Archbishop,Death Comes for the Archbishop (Paperback),Willa Cather,3.93,31716,1927,https://i.gr-assets.com/images/S/compressed.photo.goodreads.com/books/1436632846l/545951._SY75_.jpg,religion
6151.Life_of_the_Beloved,Life of the Beloved: Spiritual Living in a Secular World (Paperback),Henri J.M. Nouwen,4.1,12523,1992,https://i.gr-assets.com/images/S/compressed.photo.goodreads.com/books/1385179983l/6151._SX50_.jpg,religion
136977.The_Places_That_Scare_You,The Places That Scare You: A Guide to Fearlessness in Difficult Times (Paperback),Pema Chödrön,4.16,18830,2001,https://i.gr-assets.com/images/S/compressed.photo.goodreads.com/books/1172087249l/136977._SY75_.jpg,religion
60551.The_B,The Book: On the Taboo Against Knowing Who You Are (Mass Market Paperback),Alan W. Watts,4.19,19338,1966,https://i.gr-assets.com/images/S/compressed.photo.goodreads.com/books/1403166178l/60551._SY75_.jpg,religion
71728.Jonathan_Livingston_Seagull,Jonathan Livingston Seagull (Paperback),Richard Bach,3.85,222213,1970,https://i.gr-assets.com/images/S/compressed.photo.goodreads.com/books/1432222358l/71728._SX50_.jpg,religion
29397486-conclave,Conclave (Kindle Edition),Robert   Harris,3.95,24026,2016,https://i.gr-assets.com/images/S/compressed.photo.goodreads.com/books/1456938720l/29397486._SX50_.jpg,religion
1999475.A_Million_Miles_in_a_Thousand_Year,A Million Miles in a Thousand Years: What I Learned While Editing My Life (Hardcover),Donald Miller,4.1,29356,2009,https://i.gr-assets.com/images/S/compressed.photo.goodreads.com/books/1440864796l/1999475._SY75_.jpg,religion
3905412-i-m-perfect-you-re-doomed,"I'm Perfect, You're Doomed: Tales from a Jehovah's Witness Upbringing (Hardcover)",Kyria Abrahams,3.41,1691,2009,https://i.gr-assets.com/images/S/compressed.photo.goodreads.com/books/1438521477l/3905412._SY75_.jpg,religion
589064.The_Masks_of_God_Volume_1,"The Masks of God, Volume 1: Primitive Mythology (Paperback)",Joseph Campbell,4.28,3920,1959,https://i.gr-assets.com/images/S/compressed.photo.goodreads.com/books/1384016948l/589064._SY75_.jpg,religion
884484.What_s_So_Great_About_Christianity,What's So Great About Christianity (Hardcover),Dinesh D'Souza,3.99,2396,2007,https://i.gr-assets.com/images/S/compressed.photo.goodreads.com/books/1348308797l/884484._SY75_.jpg,religion
25669.How_the_Irish_Saved_Civilization,How the Irish Saved Civilization: The Untold Story of Ireland's Heroic Role from the Fall of Rome to the Rise of Medieval Europe  (Paperback),Thomas Cahill,3.8,43892,1995,https://i.gr-assets.com/images/S/compressed.photo.goodreads.com/books/1403191471l/25669._SY75_.jpg,religion
213743.How_to_Practice,How to Practice: The Way to a Meaningful Life (Paperback),Dalai Lama XIV,4.03,9912,2002,https://i.gr-assets.com/images/S/compressed.photo.goodreads.com/books/1347968540l/213743._SX50_.jpg,religion
821056.Hinds_Feet_on_High_Place,Hinds' Feet on High Places (Paperback),Hannah Hurnard,4.28,50629,1955,https://i.gr-assets.com/images/S/compressed.photo.goodreads.com/books/1312284337l/821056._SY75_.jpg,religion
69417.A_Chosen_Fait,A Chosen Faith: An Introduction to Unitarian Universalism (Paperback),John A. Buehrens,3.89,997,1997,https://i.gr-assets.com/images/S/compressed.photo.goodreads.com/books/1393783544l/69417._SX50_.jpg,religion
761925.The_Guide_for_the_Perplexed,The Guide for the Perplexed (Paperback),Maimonides,4.11,1085,1190,https://i.gr-assets.com/images/S/compressed.photo.goodreads.com/books/1328865322l/761925._SY75_.jpg,religion
464260.The_Fire_Next_Time,The Fire Next Time (Paperback),James Baldwin,4.5,79104,1963,https://i.gr-assets.com/images/S/compressed.photo.goodreads.com/books/1632509721l/464260._SY75_.jpg,religion
538845.Quo_Vadi,Quo Vadis (Paperback),Henryk Sienkiewicz,4.13,29515,1896,https://i.gr-assets.com/images/S/compressed.photo.goodreads.com/books/1340709653l/538845._SY75_.jpg,religion
40046077-women-talking,Women Talking (Hardcover),Miriam Toews,3.58,24521,2018,https://i.gr-assets.com/images/S/compressed.photo.goodreads.com/books/1530534348l/40046077._SY75_.jpg,religion
35883430-i-m-still-here,I'm Still Here: Black Dignity in a World Made for Whiteness (Hardcover),Austin Channing Brown,4.38,59914,2018,https://i.gr-assets.com/images/S/compressed.photo.goodreads.com/books/1591121285l/35883430._SY75_.jpg,religion
25906380-the-atheist-muslim,The Atheist Muslim: A Journey from Religion to Reason (Hardcover),Ali A. Rizvi,4.32,981,2016,https://i.gr-assets.com/images/S/compressed.photo.goodreads.com/books/1463811839l/25906380._SY75_.jpg,religion
6943146-nine-live,Nine Lives (Paperback),William Dalrymple,4.05,7221,2009,https://i.gr-assets.com/images/S/compressed.photo.goodreads.com/books/1329136130l/6943146._SY75_.jpg,religion
27312.Holy_War,Holy War: The Crusades and Their Impact on Today's World (Paperback),Karen Armstrong,3.96,1475,1988,https://i.gr-assets.com/images/S/compressed.photo.goodreads.com/books/1320496542l/27312._SY75_.jpg,religion
89281.Why_People_Believe_Weird_Thing,"Why People Believe Weird Things: Pseudoscience, Superstition, and Other Confusions of Our Time (Paperback)",Michael Shermer,3.87,9492,1997,https://i.gr-assets.com/images/S/compressed.photo.goodreads.com/books/1312054576l/89281._SY75_.jpg,religion
52764767-white-too-long,White Too Long: The Legacy of White Supremacy in American Christianity (Hardcover),Robert P. Jones,4.44,1453,2020,https://i.gr-assets.com/images/S/compressed.photo.goodreads.com/books/1570969980l/52764767._SY75_.jpg,religion
41155465-it-s-not-about-the-burqa,It's Not About the Burqa (Hardcover),Mariam Khan,4.28,4224,2019,https://i.gr-assets.com/images/S/compressed.photo.goodreads.com/books/1568471591l/41155465._SY75_.jpg,religion
24611425-the-secret-chord,The Secret Chord (Hardcover),Geraldine Brooks,3.6,16187,2015,https://i.gr-assets.com/images/S/compressed.photo.goodreads.com/books/1428406962l/24611425._SY75_.jpg,religion
10361826-why-we-believe-in-god-,Why We Believe in God(s): A Concise Guide to the Science of Faith,J. Anderson Thomson,3.96,1185,2011,https://i.gr-assets.com/images/S/compressed.photo.goodreads.com/books/1414559040l/10361826._SX50_.jpg,religion
7848348-the-rage-against-god,The Rage Against God: How Atheism Led Me to Faith (Hardcover),Peter Hitchens,3.76,1817,2009,https://i.gr-assets.com/images/S/compressed.photo.goodreads.com/books/1425325210l/7848348._SY75_.jpg,religion
64369.Mindfulness_in_Plain_Engli,Mindfulness in Plain English (Paperback),Henepola Gunaratana,4.07,16834,1992,https://i.gr-assets.com/images/S/compressed.photo.goodreads.com/books/1385189327l/64369._SY75_.jpg,religion
253881.When_Jesus_Became_God,When Jesus Became God: The Struggle to Define Christianity during the Last Days of Rome (Paperback),Richard E. Rubenstein,4.07,1200,1999,https://i.gr-assets.com/images/S/compressed.photo.goodreads.com/books/1441048885l/253881._SX50_.jpg,religion
27526.Desecration,"Desecration (Left Behind, #9)",Tim LaHaye,3.99,25318,2001,https://i.gr-assets.com/images/S/compressed.photo.goodreads.com/books/1406505722l/27526._SY75_.jpg,religion
100933.That_Hideous_Strengt,"That Hideous Strength (The Space Trilogy, #3)",C.S. Lewis,3.88,35690,1945,https://i.gr-assets.com/images/S/compressed.photo.goodreads.com/books/1348645618l/100933._SY75_.jpg,religion
45747.In_Gods_We_Trust,In Gods We Trust: The Evolutionary Landscape of Religion (Paperback),Scott Atran,3.98,290,2002,https://i.gr-assets.com/images/S/compressed.photo.goodreads.com/books/1408313748l/45747._SX50_.jpg,religion
83580.How_We_Believe,"How We Believe: Science, Skepticism, and the Search for God (Paperback)",Michael Shermer,3.97,3505,1999,https://i.gr-assets.com/images/S/compressed.photo.goodreads.com/books/1316637236l/83580._SY75_.jpg,religion
203979.The_Long_Loneline,The Long Loneliness: The Autobiography of the Legendary Catholic Social Activist (Paperback),Dorothy Day,3.9,5337,1952,https://i.gr-assets.com/images/S/compressed.photo.goodreads.com/books/1405026010l/203979._SX50_.jpg,religion
206058.Finding_Darwin_s_God,Finding Darwin's God: A Scientist's Search for Common Ground Between God and Evolution (Paperback),Kenneth R. Miller,3.94,1420,1999,https://i.gr-assets.com/images/S/compressed.photo.goodreads.com/books/1410761731l/206058._SY75_.jpg,religion
28022.Shamanism,Shamanism: Archaic Techniques of Ecstasy (Paperback),Mircea Eliade,4.21,2361,1951,https://i.gr-assets.com/images/S/compressed.photo.goodreads.com/books/1400886534l/28022._SY75_.jpg,religion
35187179-the-conference-of-the-bird,The Conference of the Birds (Paperback),Attar of Nishapur,4.23,4694,1177,https://i.gr-assets.com/images/S/compressed.photo.goodreads.com/books/1523531563l/35187179._SX50_.jpg,religion
223887.The_Jesus_Mysterie,"The Jesus Mysteries: Was the ""Original Jesus"" a Pagan God? (Paperback)",Tim Freke,3.98,1605,1999,https://i.gr-assets.com/images/S/compressed.photo.goodreads.com/books/1388606186l/223887._SY75_.jpg,religion
81229.The_Caged_Virgin,The Caged Virgin: An Emancipation Proclamation for Women and Islam (Hardcover),Ayaan Hirsi Ali,3.75,2536,2002,https://i.gr-assets.com/images/S/compressed.photo.goodreads.com/books/1436729189l/81229._SY75_.jpg,religion
29982186-the-gita-way--secret-recipe-to-achieve-the-purpose-of-life,The Gita Way- Secret Recipe to achieve the purpose of life (Paperback),Shweta Chandra,3.59,2164,2016,https://i.gr-assets.com/images/S/compressed.photo.goodreads.com/books/1461408868l/29982186._SX50_.jpg,religion
38212120-the-rise-and-fall-of-adam-and-eve,The Rise and Fall of Adam and Eve: The Story That Created Us (Paperback),Stephen Greenblatt,3.92,1253,2017,https://i.gr-assets.com/images/S/compressed.photo.goodreads.com/books/1519082962l/38212120._SX50_.jpg,religion
878682.The_Spiritual_Exercise,The Spiritual Exercises (Paperback),Ignatius of Loyola,3.92,4530,1548,https://i.gr-assets.com/images/S/compressed.photo.goodreads.com/books/1320500021l/878682._SY75_.jpg,religion
74665.Atheism,Atheism: A Very Short Introduction (Paperback),Julian Baggini,3.9,1198,2003,https://i.gr-assets.com/images/S/compressed.photo.goodreads.com/books/1434830481l/74665._SY75_.jpg,religion
71656.Peter_Paul_Mary_Magdalene,"Peter, Paul & Mary Magdalene: The Followers of Jesus in History & Legend (Hardcover)",Bart D. Ehrman,3.85,885,2006,https://i.gr-assets.com/images/S/compressed.photo.goodreads.com/books/1477449404l/71656._SY75_.jpg,religion
967775.How_to_Read_the_Bible,"How to Read the Bible: A Guide to Scripture, Then and Now (Hardcover)",James L. Kugel,4.31,956,2007,https://i.gr-assets.com/images/S/compressed.photo.goodreads.com/books/1437191897l/967775._SY75_.jpg,religion
129377.An_Introduction_to_Zen_Buddhism,An Introduction to Zen Buddhism (Paperback),D.T. Suzuki,3.86,5466,1934,https://i.gr-assets.com/images/S/compressed.photo.goodreads.com/books/1347365650l/129377._SY75_.jpg,religion
22739972-the-crucible-of-doubt,The Crucible of Doubt: Reflections On the Quest for Faith (Hardcover),Terryl L. Givens,4.47,2197,2014,https://i.gr-assets.com/images/S/compressed.photo.goodreads.com/books/1408981581l/22739972._SX50_.jpg,religion
775405.Desire_of_the_Everlasting_Hill,Desire of the Everlasting Hills: The World Before and After Jesus (Paperback),Thomas Cahill,3.96,2453,1999,https://i.gr-assets.com/images/S/compressed.photo.goodreads.com/books/1320443054l/775405._SY75_.jpg,religion
97753.The_Question_of_God,"The Question of God: C.S. Lewis and Sigmund Freud Debate God, Love, Sex, and the Meaning of Life (Paperback)",Armand M. Nicholi Jr.,4.01,4070,1988,https://i.gr-assets.com/images/S/compressed.photo.goodreads.com/books/1348754344l/97753._SY75_.jpg,religion
54233271-the-making-of-biblical-womanhood,The Making of Biblical Womanhood: How the Subjugation of Women Became Gospel Truth (Paperback),Beth Allison Barr,4.48,4415,2021,https://i.gr-assets.com/images/S/compressed.photo.goodreads.com/books/1630978093l/54233271._SY75_.jpg,religion
89937.Principia_Discordia_Or_How_I_Found_Goddess_and_What_I_Did_to_Her_When_I_Found_Her,Principia Discordia ● Or ● How I Found Goddess and What I Did to Her When I Found Her: The Magnum Opiate of Malaclypse the Younger (Paperback),Gregory  Hill,4.27,5203,1965,https://i.gr-assets.com/images/S/compressed.photo.goodreads.com/books/1223646898l/89937._SY75_.jpg,religion
18085419-learning-to-walk-in-the-dar,Learning to Walk in the Dark (Hardcover),Barbara Brown Taylor,3.94,8023,2014,https://i.gr-assets.com/images/S/compressed.photo.goodreads.com/books/1379533636l/18085419._SY75_.jpg,religion
17572142-radical,Radical: My Journey out of Islamist Extremism (Hardcover),Maajid Nawaz,4.05,2628,2012,https://i.gr-assets.com/images/S/compressed.photo.goodreads.com/books/1374654823l/17572142._SY75_.jpg,religion
574361.Teachings_of_the_Prophet_Joseph_Smit,Teachings of the Prophet Joseph Smith (Paperback),Joseph Smith Jr.,4.48,3377,1938,https://i.gr-assets.com/images/S/compressed.photo.goodreads.com/books/1409024254l/574361._SY75_.jpg,religion
796429.The_Three_Pillars_of_Zen,The Three Pillars of Zen (Paperback),Philip Kapleau,3.99,7355,1965,https://i.gr-assets.com/images/S/compressed.photo.goodreads.com/books/1436737433l/796429._SY75_.jpg,religion
27530.The_Remnant,"The Remnant (Left Behind, #10)",Tim LaHaye,3.99,24349,2002,https://i.gr-assets.com/images/S/compressed.photo.goodreads.com/books/1406506156l/27530._SY75_.jpg,religion
44140367-a-pilgrimage-to-eternity,A Pilgrimage to Eternity: From Canterbury to Rome in Search of a Faith (Hardcover),Timothy Egan,4.12,2589,2019,https://i.gr-assets.com/images/S/compressed.photo.goodreads.com/books/1564753333l/44140367._SY75_.jpg,religion
449017.Praise_of_Folly,Praise of Folly (Paperback),Erasmus,3.87,14903,1511,https://i.gr-assets.com/images/S/compressed.photo.goodreads.com/books/1539583557l/449017._SY75_.jpg,religion
530114._Believing_Women_in_Islam,"""Believing Women"" in Islam: Unreading Patriarchal Interpretations of the Qur'an (Paperback)",Asma Barlas,4.28,1267,2002,https://i.gr-assets.com/images/S/compressed.photo.goodreads.com/books/1348961323l/530114._SX50_.jpg,religion
107273.Lost_Christianitie,Lost Christianities: The Battles for Scripture and the Faiths We Never Knew (Paperback),Bart D. Ehrman,4.05,5527,2002,https://i.gr-assets.com/images/S/compressed.photo.goodreads.com/books/1477449180l/107273._SY75_.jpg,religion
870160.Zen_Flesh_Zen_Bone,"Zen Flesh, Zen Bones: A Collection of Zen and Pre-Zen Writings (Paperback)",Paul Reps,4.09,8906,1957,https://i.gr-assets.com/images/S/compressed.photo.goodreads.com/books/1364139107l/870160._SX50_.jpg,religion
8592946-one-thousand-gift,One Thousand Gifts: A Dare to Live Fully Right Where You Are (Hardcover),Ann Voskamp,4.0,52222,2011,https://i.gr-assets.com/images/S/compressed.photo.goodreads.com/books/1393970725l/8592946._SX50_.jpg,religion
4487598-the-bonobo-and-the-atheist,The Bonobo and the Atheist: In Search of Humanism Among the Primates (Hardcover),Frans de Waal,4.12,4383,2013,https://i.gr-assets.com/images/S/compressed.photo.goodreads.com/books/1356115109l/4487598._SY75_.jpg,religion
12958803-when-god-talks-bac,When God Talks Back: Understanding the American Evangelical Relationship with God (Hardcover),T.M. Luhrmann,3.93,807,2012,https://i.gr-assets.com/images/S/compressed.photo.goodreads.com/books/1333576388l/12958803._SY75_.jpg,religion
1873944.Irreligion,Irreligion: A Mathematician Explains Why the Arguments for God Just Don't Add Up (Hardcover),John Allen Paulos,3.67,2183,2008,https://i.gr-assets.com/images/S/compressed.photo.goodreads.com/books/1316635760l/1873944._SX50_.jpg,religion
133298.Jerusalem,"Jerusalem: One City, Three Faiths (Paperback)",Karen Armstrong,3.95,1109,1996,https://i.gr-assets.com/images/S/compressed.photo.goodreads.com/books/1320474568l/133298._SY75_.jpg,religion
544652.On_Christian_Liberty,On Christian Liberty (Paperback),Martin Luther,3.97,2272,1520,https://i.gr-assets.com/images/S/compressed.photo.goodreads.com/books/1348449966l/544652._SY75_.jpg,religion
34217597-breaking-free,"Breaking Free: How I Escaped My Father-Warren Jeffs-Polygamy, and the FLDS Cult (Paperback)",Rachel Jeffs,4.04,7703,2017,https://i.gr-assets.com/images/S/compressed.photo.goodreads.com/books/1498607251l/34217597._SY75_.jpg,religion
772852.The_Cross_and_the_Switchblade,The Cross and the Switchblade (Paperback),David Wilkerson,4.21,52797,1963,https://i.gr-assets.com/images/S/compressed.photo.goodreads.com/books/1347295767l/772852._SY75_.jpg,religion
61536.A_Devil_s_Chaplain,"A Devil's Chaplain: Reflections on Hope, Lies, Science, and Love (Paperback)",Richard Dawkins,3.98,7652,2003,https://i.gr-assets.com/images/S/compressed.photo.goodreads.com/books/1432857937l/61536._SY75_.jpg,religion
31247643-hallelujah-anyway,Hallelujah Anyway: Rediscovering Mercy (Hardcover),Anne Lamott,3.67,11572,2017,https://i.gr-assets.com/images/S/compressed.photo.goodreads.com/books/1474587434l/31247643._SY75_.jpg,religion
7588.A_Portrait_of_the_Artist_as_a_Young_Man,A Portrait of the Artist as a Young Man (Paperback),James Joyce,3.62,135808,1916,https://i.gr-assets.com/images/S/compressed.photo.goodreads.com/books/1554800429l/7588._SY75_.jpg,religion
21965107-the-children-act,The Children Act (Hardcover),Ian McEwan,3.7,74024,2014,https://i.gr-assets.com/images/S/compressed.photo.goodreads.com/books/1405290619l/21965107._SX50_.jpg,religion
13799973-misreading-scripture-with-western-eye,Misreading Scripture with Western Eyes: Removing Cultural Blinders to Better Understand the Bible (Paperback),E. Randolph Richards,4.33,3867,2012,https://i.gr-assets.com/images/S/compressed.photo.goodreads.com/books/1355943970l/13799973._SX50_.jpg,religion
6957758-confession-of-a-buddhist-atheist,Confession of a Buddhist Atheist (Hardcover),Stephen Batchelor,3.81,5305,2010,https://i.gr-assets.com/images/S/compressed.photo.goodreads.com/books/1320520717l/6957758._SY75_.jpg,religion
488356.Essential_Judaism,"Essential Judaism: A Complete Guide to Beliefs, Customs and Rituals (Paperback)",George    Robinson,4.15,786,2000,https://i.gr-assets.com/images/S/compressed.photo.goodreads.com/books/1348252706l/488356._SY75_.jpg,religion
1645044.The_Devil_s_Delusion,The Devil's Delusion: Atheism and Its Scientific Pretensions (Hardcover),David Berlinski,3.98,1745,2008,https://i.gr-assets.com/images/S/compressed.photo.goodreads.com/books/1320516353l/1645044._SY75_.jpg,religion
30010106-liturgy-of-the-ordinary,Liturgy of the Ordinary: Sacred Practices in Everyday Life (Paperback),Tish Harrison Warren,4.27,11310,2016,https://i.gr-assets.com/images/S/compressed.photo.goodreads.com/books/1463948524l/30010106._SX50_.jpg,religion
40611328-ishmael,Ishmael (Kindle Edition),Daniel Quinn,3.97,91117,1992,https://i.gr-assets.com/images/S/compressed.photo.goodreads.com/books/1529680413l/40611328._SY75_.jpg,religion
61286.The_Jewish_Study_Bible,The Jewish Study Bible: Featuring the Jewish Publication Society Tanakh Translation (Hardcover),Adele Berlin,4.45,1520,2003,https://i.gr-assets.com/images/S/compressed.photo.goodreads.com/books/1386925377l/61286._SX50_.jpg,religion
173454.The_Divine_Conspiracy,The Divine Conspiracy: Rediscovering Our Hidden Life in God (Hardcover),Dallas Willard,4.09,14308,1998,https://i.gr-assets.com/images/S/compressed.photo.goodreads.com/books/1347956477l/173454._SY75_.jpg,religion
427965.Whose_Bible_Is_It_A_History_of_the_Scriptures_Through_the_Age,Whose Bible Is It? A History of the Scriptures Through the Ages (Hardcover),Jaroslav Pelikan,3.87,696,2005,https://i.gr-assets.com/images/S/compressed.photo.goodreads.com/books/1442734380l/427965._SY75_.jpg,religion
776153.Truth_Restored,Truth Restored (Paperback),Gordon B. Hinckley,4.34,4280,1947,https://i.gr-assets.com/images/S/compressed.photo.goodreads.com/books/1204165317l/776153._SX50_.jpg,religion
31068.Letters_to_Malcolm,Letters to Malcolm: Chiefly on Prayer (Paperback),C.S. Lewis,3.9,5192,1964,https://i.gr-assets.com/images/S/compressed.photo.goodreads.com/books/1374875659l/31068._SY75_.jpg,religion
596258.Way_to_Be_,Way to Be!: 9 Ways To Be Happy And Make Something Of Your Life (Hardcover),Gordon B. Hinckley,4.6,8105,2002,https://i.gr-assets.com/images/S/compressed.photo.goodreads.com/books/1388206727l/596258._SX50_.jpg,religion
148488.The_Essence_of_Christianity,The Essence of Christianity (Paperback),Ludwig Feuerbach,3.8,708,1841,https://i.gr-assets.com/images/S/compressed.photo.goodreads.com/books/1365463959l/148488._SY75_.jpg,religion
14096.Wherever_You_Go_There_You_Are,"Wherever You Go, There You Are: Mindfulness Meditation in Everyday Life (Paperback)",Jon Kabat-Zinn,4.09,42244,1994,https://i.gr-assets.com/images/S/compressed.photo.goodreads.com/books/1440661171l/14096._SX50_.jpg,religion
129876.The_Ramayana,The Ramayana: A Shortened Modern Prose Version of the Indian Epic (Paperback),R.K. Narayan,3.92,4480,1972,https://i.gr-assets.com/images/S/compressed.photo.goodreads.com/books/1567626265l/129876._SY75_.jpg,religion
103758.Zen_in_the_Art_of_Archery,Zen in the Art of Archery (Mass Market Paperback),Eugen Herrigel,3.96,13454,1948,https://i.gr-assets.com/images/S/compressed.photo.goodreads.com/books/1385118414l/103758._SY75_.jpg,religion
362413.The_Road_to_Mecca,The Road to Mecca (Paperback),Muhammad Asad,4.47,4810,1954,https://i.gr-assets.com/images/S/compressed.photo.goodreads.com/books/1431869627l/362413._SY75_.jpg,religion
31625593-the-benedict-option,The Benedict Option: A Strategy for Christians in a Post-Christian Nation (Hardcover),Rod Dreher,3.78,4769,2017,https://i.gr-assets.com/images/S/compressed.photo.goodreads.com/books/1471974415l/31625593._SX50_.jpg,religion
13072449-the-mormon-people,The Mormon People: The Making of an American Faith (Hardcover),Matthew Bowman,3.85,915,2012,https://i.gr-assets.com/images/S/compressed.photo.goodreads.com/books/1333578861l/13072449._SX50_.jpg,religion
27577.What_Went_Wrong_The_Clash_Between_Islam_Modernity_in_the_Middle_East,What Went Wrong? The Clash Between Islam & Modernity in the Middle East (Paperback),Bernard Lewis,3.52,3322,2001,https://i.gr-assets.com/images/S/compressed.photo.goodreads.com/books/1407707585l/27577._SY75_.jpg,religion
180939.Buckland_s_Complete_Book_of_Witchcraft,Buckland's Complete Book of Witchcraft (Paperback),Raymond Buckland,3.78,8646,1986,https://i.gr-assets.com/images/S/compressed.photo.goodreads.com/books/1347357078l/180939._SX50_.jpg,religion
136846.Through_the_Narrow_Gate,Through the Narrow Gate: A Memoir of Spiritual Discovery (Paperback),Karen Armstrong,4.11,1788,1981,https://i.gr-assets.com/images/S/compressed.photo.goodreads.com/books/1316638648l/136846._SY75_.jpg,religion
232567.The_Phenomenon_of_Man,The Phenomenon of Man (Paperback),Pierre Teilhard de Chardin,4.06,1433,1955,https://i.gr-assets.com/images/S/compressed.photo.goodreads.com/books/1401994573l/232567._SY75_.jpg,religion
29963522-the-shia-revival,The Shia Revival: How Conflicts within Islam Will Shape the Future (Kindle Edition),Vali Nasr,3.89,2286,2006,https://i.gr-assets.com/images/S/compressed.photo.goodreads.com/books/1461126683l/29963522._SY75_.jpg,religion
34659293-heretics-anonymou,Heretics Anonymous (Hardcover),Katie Henry,3.87,10019,2018,https://i.gr-assets.com/images/S/compressed.photo.goodreads.com/books/1507339506l/34659293._SY75_.jpg,religion
28363993-finding-god-in-the-wave,Finding God in the Waves: How I Lost My Faith and Found It Again Through Science (Hardcover),Mike McHargue,4.27,4271,2016,https://i.gr-assets.com/images/S/compressed.photo.goodreads.com/books/1461534888l/28363993._SX50_.jpg,religion
2659997-stolen-innocence,"Stolen Innocence: My Story of Growing Up in a Polygamous Sect, Becoming a Teenage Bride, and Breaking Free of Warren Jeffs (Hardcover)",Elissa Wall,3.89,28257,2008,https://i.gr-assets.com/images/S/compressed.photo.goodreads.com/books/1255629380l/2659997._SY75_.jpg,religion
821380.Myths_to_Live_By,Myths to Live By (Paperback),Joseph Campbell,4.05,7466,1972,https://i.gr-assets.com/images/S/compressed.photo.goodreads.com/books/1348222069l/821380._SY75_.jpg,religion
56539.The_Koran,The Koran: A Very Short Introduction (Paperback),Michael A. Cook,3.39,631,2000,https://i.gr-assets.com/images/S/compressed.photo.goodreads.com/books/1433212857l/56539._SY75_.jpg,religion
90866.God_Against_the_God,God Against the Gods: The History of the War Between Monotheism and Polytheism (Paperback),Jonathan Kirsch,3.96,633,2004,https://i.gr-assets.com/images/S/compressed.photo.goodreads.com/books/1327795659l/90866._SY75_.jpg,religion
34348320-martin-luther,Martin Luther: The Man Who Rediscovered God and Changed the World (Hardcover),Eric Metaxas,3.92,8033,2017,https://i.gr-assets.com/images/S/compressed.photo.goodreads.com/books/1490860536l/34348320._SY75_.jpg,religion
33358204-boy-erased,"Boy Erased: A Memoir of Identity, Faith, and Family (Paperback)",Garrard Conley,3.62,16549,2016,https://i.gr-assets.com/images/S/compressed.photo.goodreads.com/books/1484165172l/33358204._SY75_.jpg,religion
12051147-gospel-principle,Gospel Principles (Paperback),The Church of Jesus Christ of Latter-day Saints,4.48,4331,1978,https://i.gr-assets.com/images/S/compressed.photo.goodreads.com/books/1310791198l/12051147._SY75_.jpg,religion
