Id,Title,Author,Average Rating,Number of ratings,Year of publishing,Url of image,Genre
9791.A_Walk_in_the_Wood,A Walk in the Woods: Rediscovering America on the Appalachian Trail (Mass Market Paperback),Bill Bryson,4.05,372504,1998,https://i.gr-assets.com/images/S/compressed.photo.goodreads.com/books/1388189974l/9791._SY75_.jpg,travel
24.In_a_Sunburned_Country,In a Sunburned Country (Paperback),Bill Bryson,4.06,100883,2000,https://i.gr-assets.com/images/S/compressed.photo.goodreads.com/books/1388176242l/24._SY75_.jpg,travel
28.Notes_from_a_Small_Island,Notes from a Small Island (Paperback),Bill Bryson,3.9,105677,1995,https://i.gr-assets.com/images/S/compressed.photo.goodreads.com/books/1479653223l/28._SY75_.jpg,travel
19501.Eat_Pray_Love,"Eat, Pray, Love: One Woman's Search for Everything Across Italy, India and Indonesia (Paperback)",Elizabeth Gilbert,3.59,1587447,2006,https://i.gr-assets.com/images/S/compressed.photo.goodreads.com/books/1503066414l/19501._SY75_.jpg,travel
27.Neither_Here_nor_There,Neither Here nor There: Travels in Europe (Paperback),Bill Bryson,3.84,70278,1991,https://i.gr-assets.com/images/S/compressed.photo.goodreads.com/books/1388187396l/27._SY75_.jpg,travel
12262741-wild,Wild: From Lost to Found on the Pacific Crest Trail (Hardcover),Cheryl Strayed,4.02,685096,2012,https://i.gr-assets.com/images/S/compressed.photo.goodreads.com/books/1453189881l/12262741._SY75_.jpg,travel
26.The_Lost_Continent,The Lost Continent: Travels in Small Town America (Paperback),Bill Bryson,3.81,58263,1989,https://i.gr-assets.com/images/S/compressed.photo.goodreads.com/books/1404042682l/26._SY75_.jpg,travel
1845.Into_the_Wild,Into the Wild (Paperback),Jon Krakauer,3.99,955698,1996,https://i.gr-assets.com/images/S/compressed.photo.goodreads.com/books/1634587789l/1845._SY75_.jpg,travel
5306.Travels_with_Charley,Travels with Charley: In Search of America (Paperback),John Steinbeck,4.03,84412,1962,https://i.gr-assets.com/images/S/compressed.photo.goodreads.com/books/1386924381l/5306._SY75_.jpg,travel
100247.Vagabonding,Vagabonding: An Uncommon Guide to the Art of Long-Term World Travel (Paperback),Rolf Potts,3.94,22479,2002,https://i.gr-assets.com/images/S/compressed.photo.goodreads.com/books/1320532720l/100247._SY75_.jpg,travel
25.I_m_a_Stranger_Here_Myself,I'm a Stranger Here Myself: Notes on Returning to America After Twenty Years Away (Paperback),Bill Bryson,3.87,66212,1999,https://i.gr-assets.com/images/S/compressed.photo.goodreads.com/books/1388184037l/25._SY75_.jpg,travel
40189.A_Year_in_Provence,A Year in Provence (Paperback),Peter Mayle,3.96,71123,1989,https://i.gr-assets.com/images/S/compressed.photo.goodreads.com/books/1535746681l/40189._SY75_.jpg,travel
480479.Under_the_Tuscan_Sun,Under the Tuscan Sun (Paperback),Frances Mayes,3.76,321973,1996,https://i.gr-assets.com/images/S/compressed.photo.goodreads.com/books/1320524083l/480479._SY75_.jpg,travel
70401.On_the_Road,On the Road (Paperback),Jack Kerouac,3.62,375332,1957,https://i.gr-assets.com/images/S/compressed.photo.goodreads.com/books/1413588576l/70401._SX50_.jpg,travel
25489012-the-road-to-little-dribbling,The Road to Little Dribbling: Adventures of an American in Britain (Hardcover),Bill Bryson,3.69,34767,2015,https://i.gr-assets.com/images/S/compressed.photo.goodreads.com/books/1444259875l/25489012._SY75_.jpg,travel
63689.The_Great_Railway_Bazaar,The Great Railway Bazaar (Paperback),Paul Theroux,3.91,18036,1975,https://i.gr-assets.com/images/S/compressed.photo.goodreads.com/books/1440437557l/63689._SY75_.jpg,travel
11525.1_000_Places_to_See_Before_You_Die,"1,000 Places to See Before You Die (Paperback)",Patricia Schultz,3.87,39891,2003,https://i.gr-assets.com/images/S/compressed.photo.goodreads.com/books/1387718704l/11525._SX50_.jpg,travel
23422.The_Art_of_Travel,The Art of Travel (Paperback),Alain de Botton,3.83,21388,2002,https://i.gr-assets.com/images/S/compressed.photo.goodreads.com/books/1388262692l/23422._SY75_.jpg,travel
1918305.The_Geography_of_Bli,The Geography of Bliss: One Grump's Search for the Happiest Places in the World (Paperback),Eric    Weiner,3.83,35855,2008,https://i.gr-assets.com/images/S/compressed.photo.goodreads.com/books/1347304179l/1918305._SY75_.jpg,travel
1898.Into_Thin_Air,Into Thin Air: A Personal Account of the Mount Everest Disaster (Paperback),Jon Krakauer,4.19,435396,1997,https://i.gr-assets.com/images/S/compressed.photo.goodreads.com/books/1631501298l/1898._SY75_.jpg,travel
79909.In_Patagonia,In Patagonia (Paperback),Bruce Chatwin,3.71,14392,1977,https://i.gr-assets.com/images/S/compressed.photo.goodreads.com/books/1386924798l/79909._SY75_.jpg,travel
63832.Blue_Highway,Blue Highways (Paperback),William Least Heat-Moon,4.03,22311,1982,https://i.gr-assets.com/images/S/compressed.photo.goodreads.com/books/1425628317l/63832._SY75_.jpg,travel
28239.Dark_Star_Safari,Dark Star Safari: Overland from Cairo to Cape Town (Paperback),Paul Theroux,3.98,13795,2002,https://i.gr-assets.com/images/S/compressed.photo.goodreads.com/books/1441636831l/28239._SY75_.jpg,travel
11077.The_Sex_Lives_of_Cannibal,The Sex Lives of Cannibals: Adrift in the Equatorial Pacific (Paperback),J. Maarten Troost,3.86,24102,2003,https://i.gr-assets.com/images/S/compressed.photo.goodreads.com/books/1386924418l/11077._SY75_.jpg,travel
253984.A_Time_of_Gift,A Time of Gifts (Paperback),Patrick Leigh Fermor,4.06,7110,1977,https://i.gr-assets.com/images/S/compressed.photo.goodreads.com/books/1632510834l/253984._SY75_.jpg,travel
10111087-turn-right-at-machu-picchu,Turn Right at Machu Picchu: Rediscovering the Lost City One Step at a Time (Hardcover),Mark    Adams,3.85,16429,2011,https://i.gr-assets.com/images/S/compressed.photo.goodreads.com/books/1311704972l/10111087._SY75_.jpg,travel
23316.Round_Ireland_with_a_Fridge,Round Ireland with a Fridge (Paperback),Tony Hawks,3.81,18002,1997,https://i.gr-assets.com/images/S/compressed.photo.goodreads.com/books/1438308095l/23316._SY75_.jpg,travel
85622.Tales_of_a_Female_Nomad,Tales of a Female Nomad: Living at Large in the World (Paperback),Rita Golden Gelman,3.82,17000,2001,https://i.gr-assets.com/images/S/compressed.photo.goodreads.com/books/1320531284l/85622._SY75_.jpg,travel
524878.Without_Reservation,Without Reservations: The Travels of an Independent Woman (Paperback),Alice Steinbach,3.81,10369,2000,https://i.gr-assets.com/images/S/compressed.photo.goodreads.com/books/1333577847l/524878._SY75_.jpg,travel
3398625-the-lost-city-of-z,The Lost City of Z: A Tale of Deadly Obsession in the Amazon (Hardcover),David Grann,3.84,84656,2009,https://i.gr-assets.com/images/S/compressed.photo.goodreads.com/books/1320487318l/3398625._SY75_.jpg,travel
28110891-atlas-obscura,Atlas Obscura: An Explorer's Guide to the World's Hidden Wonders (Hardcover),Joshua Foer,4.26,5878,2016,https://i.gr-assets.com/images/S/compressed.photo.goodreads.com/books/1469969458l/28110891._SX50_.jpg,travel
270032.Seven_Years_in_Tibet,Seven Years in Tibet (Paperback),Heinrich Harrer,4.05,22542,1953,https://i.gr-assets.com/images/S/compressed.photo.goodreads.com/books/1388251499l/270032._SY75_.jpg,travel
130515.The_Old_Patagonian_Expre,The Old Patagonian Express: By Train Through the Americas (Paperback),Paul Theroux,3.95,9502,1979,https://i.gr-assets.com/images/S/compressed.photo.goodreads.com/books/1356445513l/130515._SY75_.jpg,travel
764165.The_Snow_Leopard,The Snow Leopard (Paperback),Peter Matthiessen,4.04,16795,1978,https://i.gr-assets.com/images/S/compressed.photo.goodreads.com/books/1309211772l/764165._SY75_.jpg,travel
139373.The_Travel_B,The Travel Book: A Journey Through Every Country in the World (Paperback),Roz Hopkins,4.29,6379,2004,https://i.gr-assets.com/images/S/compressed.photo.goodreads.com/books/1391124644l/139373._SX50_.jpg,travel
122574.Getting_Stoned_with_Savage,Getting Stoned with Savages: A Trip Through the Islands of Fiji and Vanuatu (Paperback),J. Maarten Troost,3.86,12893,2006,https://i.gr-assets.com/images/S/compressed.photo.goodreads.com/books/1320524119l/122574._SY75_.jpg,travel
1975116.Lost_on_Planet_China,"Lost on Planet China: The Strange and True Story of One Man's Attempt to Understand the World's Most Mystifying Nation, or How He Became Comfortable Eating Live Squid (Hardcover)",J. Maarten Troost,3.77,11334,2008,https://i.gr-assets.com/images/S/compressed.photo.goodreads.com/books/1266942578l/1975116._SY75_.jpg,travel
95643.The_Places_in_Between,The Places in Between (Paperback),Rory Stewart,3.92,14952,2004,https://i.gr-assets.com/images/S/compressed.photo.goodreads.com/books/1567837295l/95643._SY75_.jpg,travel
86856.A_Cook_s_Tour,A Cook's Tour: Global Adventures in Extreme Cuisines (Paperback),Anthony Bourdain,4.05,24522,2001,https://i.gr-assets.com/images/S/compressed.photo.goodreads.com/books/1347785592l/86856._SY75_.jpg,travel
172732.The_Motorcycle_Diarie,The Motorcycle Diaries: Notes on a Latin American Journey (Paperback),Ernesto Che Guevara,3.75,38214,1992,https://i.gr-assets.com/images/S/compressed.photo.goodreads.com/books/1354902593l/172732._SY75_.jpg,travel
2071926.Ghost_Train_to_the_Eastern_Star,Ghost Train to the Eastern Star (Hardcover),Paul Theroux,4.04,6511,2008,https://i.gr-assets.com/images/S/compressed.photo.goodreads.com/books/1320456657l/2071926._SY75_.jpg,travel
130511.Riding_the_Iron_Rooster,Riding the Iron Rooster (Paperback),Paul Theroux,4.03,8654,1988,https://i.gr-assets.com/images/S/compressed.photo.goodreads.com/books/1320531725l/130511._SY75_.jpg,travel
2443.The_Innocents_Abroad,The Innocents Abroad (Paperback),Mark Twain,3.81,13997,1869,https://i.gr-assets.com/images/S/compressed.photo.goodreads.com/books/1388280342l/2443._SY75_.jpg,travel
22.Bill_Bryson_s_African_Diary,Bill Bryson's African Diary (Hardcover),Bill Bryson,3.46,9061,2002,https://i.gr-assets.com/images/S/compressed.photo.goodreads.com/books/1388276959l/22._SX50_.jpg,travel
78895.Trac,Tracks: A Woman's Solo Trek Across 1700 Miles of Australian Outback (Paperback),Robyn Davidson,3.92,13509,1980,https://i.gr-assets.com/images/S/compressed.photo.goodreads.com/books/1391414939l/78895._SY75_.jpg,travel
118141.A_Short_Walk_in_the_Hindu_Ku,A Short Walk in the Hindu Kush (Hardcover),Eric Newby,3.98,5737,1958,https://i.gr-assets.com/images/S/compressed.photo.goodreads.com/books/1387738186l/118141._SY75_.jpg,travel
790171.Kon_Tiki,Kon-Tiki (Paperback),Thor Heyerdahl,4.14,20965,1948,https://i.gr-assets.com/images/S/compressed.photo.goodreads.com/books/1348547584l/790171._SY75_.jpg,travel
3858.Holy_C,Holy Cow: An Indian Adventure (Paperback),Sarah Macdonald,3.54,17055,2002,https://i.gr-assets.com/images/S/compressed.photo.goodreads.com/books/1388290849l/3858._SY75_.jpg,travel
7074717-the-lost-girl,The Lost Girls: Three Friends. Four Continents. One Unconventional Detour Around the World. (Hardcover),Jennifer Baggett,3.73,8236,2010,https://i.gr-assets.com/images/S/compressed.photo.goodreads.com/books/1348964417l/7074717._SY75_.jpg,travel
13369533-the-old-way,The Old Ways: A Journey on Foot (Hardcover),Robert Macfarlane,4.15,7540,2012,https://i.gr-assets.com/images/S/compressed.photo.goodreads.com/books/1328811154l/13369533._SY75_.jpg,travel
127672.A_Year_in_the_World,A Year in the World: Journeys of a Passionate Traveller (Paperback),Frances Mayes,3.59,6617,2006,https://i.gr-assets.com/images/S/compressed.photo.goodreads.com/books/1320524098l/127672._SY75_.jpg,travel
54479.Around_the_World_in_Eighty_Day,Around the World in Eighty Days (Paperback),Jules Verne,3.94,205285,1872,https://i.gr-assets.com/images/S/compressed.photo.goodreads.com/books/1308815551l/54479._SY75_.jpg,travel
33600.Shantaram,Shantaram (Paperback),Gregory David Roberts,4.23,191093,2003,https://i.gr-assets.com/images/S/compressed.photo.goodreads.com/books/1333482282l/33600._SY75_.jpg,travel
76844.The_Songline,The Songlines (Paperback),Bruce Chatwin,3.99,10163,1987,https://i.gr-assets.com/images/S/compressed.photo.goodreads.com/books/1388186150l/76844._SY75_.jpg,travel
607639.The_Beac,The Beach (Paperback),Alex Garland,3.94,80303,1996,https://i.gr-assets.com/images/S/compressed.photo.goodreads.com/books/1348547768l/607639._SY75_.jpg,travel
23282062-the-year-of-living-danishly,The Year of Living Danishly: My Twelve Months Unearthing the Secrets of the World's Happiest Country (Paperback),Helen Russell,3.97,22581,2015,https://i.gr-assets.com/images/S/compressed.photo.goodreads.com/books/1422925714l/23282062._SY75_.jpg,travel
49436.Three_Cups_of_Tea,Three Cups of Tea: One Man's Mission to Promote Peace ... One School at a Time (Paperback),Greg Mortenson,3.65,343125,2006,https://i.gr-assets.com/images/S/compressed.photo.goodreads.com/books/1395407074l/49436._SY75_.jpg,travel
130514.The_Happy_Isles_of_Oceania,The Happy Isles of Oceania: Paddling the Pacific (Paperback),Paul Theroux,4.01,5868,1992,https://i.gr-assets.com/images/S/compressed.photo.goodreads.com/books/1171993786l/130514._SY75_.jpg,travel
18373272-what-i-was-doing-while-you-were-breeding,What I Was Doing While You Were Breeding (Paperback),Kristin Newman,3.86,15504,2014,https://i.gr-assets.com/images/S/compressed.photo.goodreads.com/books/1400881229l/18373272._SY75_.jpg,travel
629.Zen_and_the_Art_of_Motorcycle_Maintenance,"Zen and the Art of Motorcycle Maintenance: An Inquiry Into Values (Phaedrus, #1)",Robert M. Pirsig,3.77,219193,1974,https://i.gr-assets.com/images/S/compressed.photo.goodreads.com/books/1410136019l/629._SY75_.jpg,travel
12502.McCarthy_s_Bar,McCarthy's Bar: A Journey of Discovery in Ireland (Paperback),Pete McCarthy,3.81,10043,1999,https://i.gr-assets.com/images/S/compressed.photo.goodreads.com/books/1433253401l/12502._SX50_.jpg,travel
613890.Long_Way_Round,Long Way Round: Chasing Shadows Across the World (Hardcover),Ewan McGregor,3.96,10114,2004,https://i.gr-assets.com/images/S/compressed.photo.goodreads.com/books/1388350896l/613890._SY75_.jpg,travel
94529.Blue_Latitude,Blue Latitudes: Boldly Going Where Captain Cook Has Gone Before (Paperback),Tony Horwitz,4.02,9428,2002,https://i.gr-assets.com/images/S/compressed.photo.goodreads.com/books/1316136524l/94529._SX50_.jpg,travel
44255.Toujours_Provence,Toujours Provence (Paperback),Peter Mayle,4.03,27489,1991,https://i.gr-assets.com/images/S/compressed.photo.goodreads.com/books/1411874268l/44255._SY75_.jpg,travel
3110.Assassination_Vacation,Assassination Vacation (Paperback),Sarah Vowell,3.88,50423,2005,https://i.gr-assets.com/images/S/compressed.photo.goodreads.com/books/1440616283l/3110._SY75_.jpg,travel
4631.A_Moveable_Feast,A Moveable Feast (Paperback),Ernest Hemingway,4.01,133597,1964,https://i.gr-assets.com/images/S/compressed.photo.goodreads.com/books/1427463201l/4631._SX50_.jpg,travel
7966160-travels-in-siberia,Travels in Siberia (Hardcover),Ian Frazier,3.9,4257,2010,https://i.gr-assets.com/images/S/compressed.photo.goodreads.com/books/1312001406l/7966160._SY75_.jpg,travel
7062.Paris_to_the_Moon,Paris to the Moon (Paperback),Adam Gopnik,3.73,15599,2000,https://i.gr-assets.com/images/S/compressed.photo.goodreads.com/books/1388345313l/7062._SY75_.jpg,travel
398080.Driving_Over_Lemon,Driving Over Lemons: An Optimist in Andalucía (Paperback),Chris  Stewart,3.78,15294,1999,https://i.gr-assets.com/images/S/compressed.photo.goodreads.com/books/1471772890l/398080._SY75_.jpg,travel
124430.City_of_Djinn,City of Djinns: A Year in Delhi (Paperback),William Dalrymple,4.11,11040,1993,https://i.gr-assets.com/images/S/compressed.photo.goodreads.com/books/1327731460l/124430._SY75_.jpg,travel
9514649-the-good-girl-s-guide-to-getting-lost,"The Good Girl's Guide to Getting Lost: A Memoir of Three Continents, Two Friends, and One Unexpected Adventure (Paperback)",Rachel Friedman,3.79,3523,2011,https://i.gr-assets.com/images/S/compressed.photo.goodreads.com/books/1320522613l/9514649._SY75_.jpg,travel
825419.Arabian_Sand,Arabian Sands (Paperback),Wilfred Thesiger,4.18,4983,1959,https://i.gr-assets.com/images/S/compressed.photo.goodreads.com/books/1630643211l/825419._SX50_.jpg,travel
293207.Between_the_Woods_and_the_Water,Between the Woods and the Water (Paperback),Patrick Leigh Fermor,4.3,2923,1986,https://i.gr-assets.com/images/S/compressed.photo.goodreads.com/books/1632510886l/293207._SY75_.jpg,travel
701596.Shadow_of_the_Silk_Road,Shadow of the Silk Road (Hardcover),Colin Thubron,3.77,3701,2007,https://i.gr-assets.com/images/S/compressed.photo.goodreads.com/books/1347606860l/701596._SY75_.jpg,travel
860183.The_Road_to_Oxiana,The Road to Oxiana (Paperback),Robert Byron,3.91,2856,1937,https://i.gr-assets.com/images/S/compressed.photo.goodreads.com/books/1387735316l/860183._SY75_.jpg,travel
2184798.Blood_River,Blood River: A Journey to Africa's Broken Heart (Paperback),Tim Butcher,3.86,13319,2007,https://i.gr-assets.com/images/S/compressed.photo.goodreads.com/books/1531681288l/2184798._SY75_.jpg,travel
18144590-the-alchemist,The Alchemist (Paperback),Paulo Coelho,3.89,2401383,1988,https://i.gr-assets.com/images/S/compressed.photo.goodreads.com/books/1466865542l/18144590._SY75_.jpg,travel
9541.The_Shadow_of_the_Sun,The Shadow of the Sun (Paperback),Ryszard Kapuściński,4.39,12188,1998,https://i.gr-assets.com/images/S/compressed.photo.goodreads.com/books/1320560715l/9541._SY75_.jpg,travel
72210.The_Kingdom_by_the_Sea,The Kingdom by the Sea (Paperback),Paul Theroux,3.75,4158,1983,https://i.gr-assets.com/images/S/compressed.photo.goodreads.com/books/1320870098l/72210._SY75_.jpg,travel
94053.River_Town,River Town: Two Years on the Yangtze (Paperback),Peter Hessler,4.24,11854,2001,https://i.gr-assets.com/images/S/compressed.photo.goodreads.com/books/1415585591l/94053._SY75_.jpg,travel
23719344-deep-sout,Deep South: Four Seasons on Back Roads (Hardcover),Paul Theroux,3.77,4604,2015,https://i.gr-assets.com/images/S/compressed.photo.goodreads.com/books/1428630703l/23719344._SX50_.jpg,travel
37438.Hokkaido_Highway_Blue,Hokkaido Highway Blues: Hitchhiking Japan (Paperback),Will Ferguson,3.99,4991,1998,https://i.gr-assets.com/images/S/compressed.photo.goodreads.com/books/1523283622l/37438._SY75_.jpg,travel
531421.Bella_Tuscany,Bella Tuscany (Paperback),Frances Mayes,3.76,13202,1999,https://i.gr-assets.com/images/S/compressed.photo.goodreads.com/books/1427782211l/531421._SY75_.jpg,travel
6419542-travel-as-a-political-act,Travel as a Political Act (Paperback),Rick Steves,4.08,2941,2009,https://i.gr-assets.com/images/S/compressed.photo.goodreads.com/books/1348177506l/6419542._SY75_.jpg,travel
393199.Down_and_Out_in_Paris_and_London,Down and Out in Paris and London (Paperback),George Orwell,4.05,75653,1933,https://i.gr-assets.com/images/S/compressed.photo.goodreads.com/books/1347697665l/393199._SY75_.jpg,travel
40873920-the-lost-city-of-the-monkey-god,The Lost City of the Monkey God (Kindle Edition),Douglas Preston,3.91,48364,2017,https://i.gr-assets.com/images/S/compressed.photo.goodreads.com/books/1532010422l/40873920._SY75_.jpg,travel
891224.Whatever_You_Do_Don_t_Run,"Whatever You Do, Don't Run: True Tales of a Botswana Safari Guide (Paperback)",Peter Allison,3.99,9412,2007,https://i.gr-assets.com/images/S/compressed.photo.goodreads.com/books/1328814881l/891224._SY75_.jpg,travel
59664.Travels_with_Herodotu,Travels with Herodotus (Hardcover),Ryszard Kapuściński,4.06,6929,2004,https://i.gr-assets.com/images/S/compressed.photo.goodreads.com/books/1320474166l/59664._SX50_.jpg,travel
8696.Last_Chance_to_See,Last Chance to See (Paperback),Douglas Adams,4.26,24238,1990,https://i.gr-assets.com/images/S/compressed.photo.goodreads.com/books/1327867839l/8696._SY75_.jpg,travel
130512.The_Pillars_of_Hercule,The Pillars of Hercules (Paperback),Paul Theroux,3.94,4565,1995,https://i.gr-assets.com/images/S/compressed.photo.goodreads.com/books/1320426120l/130512._SY75_.jpg,travel
574929.The_Travel,The Travels (Paperback),Marco Polo,3.58,5824,1298,https://i.gr-assets.com/images/S/compressed.photo.goodreads.com/books/1442800299l/574929._SY75_.jpg,travel
131011.The_Caliph_s_House,The Caliph's House: A Year in Casablanca (Paperback),Tahir Shah,3.97,6634,2006,https://i.gr-assets.com/images/S/compressed.photo.goodreads.com/books/1320485351l/131011._SY75_.jpg,travel
21266.Rick_Steves_Europe_Through_the_Back_Door,Rick Steves' Europe Through the Back Door (Paperback),Rick Steves,4.26,5281,1982,https://i.gr-assets.com/images/S/compressed.photo.goodreads.com/books/1512785665l/21266._SY75_.jpg,travel
12880.Black_Lamb_and_Grey_Falcon,Black Lamb and Grey Falcon (Paperback),Rebecca West,4.22,2142,1941,https://i.gr-assets.com/images/S/compressed.photo.goodreads.com/books/1388190495l/12880._SY75_.jpg,travel
122781.A_Walk_Across_America,A Walk Across America (Paperback),Peter Jenkins,4.04,11286,1979,https://i.gr-assets.com/images/S/compressed.photo.goodreads.com/books/1442192805l/122781._SY75_.jpg,travel
139069.Endurance,Endurance: Shackleton's Incredible Voyage (Hardcover),Alfred Lansing,4.36,101783,1959,https://i.gr-assets.com/images/S/compressed.photo.goodreads.com/books/1391329559l/139069._SY75_.jpg,travel
41155177-lands-of-lost-border,Lands of Lost Borders: Out of Bounds on the Silk Road (Paperback),Kate  Harris,3.91,4068,2018,https://i.gr-assets.com/images/S/compressed.photo.goodreads.com/books/1553539919l/41155177._SX50_.jpg,travel
221304.Around_the_World_in_80_Day,Around the World in 80 Days: Companion to the PBS Series (Paperback),Michael Palin,4.02,6634,1990,https://i.gr-assets.com/images/S/compressed.photo.goodreads.com/books/1389668702l/221304._SX50_.jpg,travel
40858.Himalaya,Himalaya (Hardcover),Michael Palin,3.97,3740,2004,https://i.gr-assets.com/images/S/compressed.photo.goodreads.com/books/1391930788l/40858._SX50_.jpg,travel
124431.In_Xanadu,In Xanadu: A Quest (Paperback),William Dalrymple,3.99,3637,1989,https://i.gr-assets.com/images/S/compressed.photo.goodreads.com/books/1171869042l/124431._SY75_.jpg,travel
214614.Desert_Solitaire,Desert Solitaire (Paperback),Edward Abbey,4.18,44217,1968,https://i.gr-assets.com/images/S/compressed.photo.goodreads.com/books/1399583343l/214614._SY75_.jpg,travel
6055063-the-sweet-life-in-pari,The Sweet Life in Paris: Delicious Adventures in the World's Most Glorious - and Perplexing - City (Hardcover),David Lebovitz,3.85,14220,2009,https://i.gr-assets.com/images/S/compressed.photo.goodreads.com/books/1320533633l/6055063._SX50_.jpg,travel
137852.Four_Seasons_in_Rome,"Four Seasons in Rome: On Twins, Insomnia, and the Biggest Funeral in the History of the World (Hardcover)",Anthony Doerr,3.9,9813,2007,https://i.gr-assets.com/images/S/compressed.photo.goodreads.com/books/1440928018l/137852._SY75_.jpg,travel
30649506-at-home-in-the-world,At Home in the World: Reflections on Belonging While Wandering the Globe (Hardcover),Tsh Oxenreider,4.04,6836,2017,https://i.gr-assets.com/images/S/compressed.photo.goodreads.com/books/1466450151l/30649506._SY75_.jpg,travel
48132.My_Family_and_Other_Animal,"My Family and Other Animals (Corfu Trilogy, #1)",Gerald Durrell,4.13,49968,1956,https://i.gr-assets.com/images/S/compressed.photo.goodreads.com/books/1327885239l/48132._SY75_.jpg,travel
17020.13_Little_Blue_Envelope,"13 Little Blue Envelopes (Little Blue Envelope, #1)",Maureen Johnson,3.63,83956,2005,https://i.gr-assets.com/images/S/compressed.photo.goodreads.com/books/1375030179l/17020._SY75_.jpg,travel
9808172-wanderlust,Wanderlust: A Love Affair with Five Continents (Paperback),Elisabeth Eaves,3.5,3727,2011,https://i.gr-assets.com/images/S/compressed.photo.goodreads.com/books/1328746890l/9808172._SX50_.jpg,travel
331695.Almost_Frenc,Almost French: Love and a New Life in Paris (Paperback),Sarah Turnbull,3.69,16036,2003,https://i.gr-assets.com/images/S/compressed.photo.goodreads.com/books/1441921862l/331695._SY75_.jpg,travel
38085814-the-salt-pat,The Salt Path (Hardcover),Raynor Winn,4.09,41490,2018,https://i.gr-assets.com/images/S/compressed.photo.goodreads.com/books/1520119402l/38085814._SY75_.jpg,travel
1804660.Journeys_of_a_Lifetime,Journeys of a Lifetime: 500 of the World's Greatest Trips (Hardcover),National Geographic Society,4.26,2424,2007,https://i.gr-assets.com/images/S/compressed.photo.goodreads.com/books/1320559020l/1804660._SX50_.jpg,travel
163921.Full_Tilt,Full Tilt: Ireland to India with a Bicycle (Paperback),Dervla Murphy,4.06,2792,1965,https://i.gr-assets.com/images/S/compressed.photo.goodreads.com/books/1340739633l/163921._SX50_.jpg,travel
7664334-amy-roger-s-epic-detour,Amy & Roger's Epic Detour (Hardcover),Morgan Matson,3.98,95492,2010,https://i.gr-assets.com/images/S/compressed.photo.goodreads.com/books/1327989202l/7664334._SY75_.jpg,travel
15814391-the-last-train-to-zona-verde,The Last Train to Zona Verde: My Ultimate African Safari (Hardcover),Paul Theroux,3.86,3082,2013,https://i.gr-assets.com/images/S/compressed.photo.goodreads.com/books/1348098489l/15814391._SY75_.jpg,travel
781787.Out_of_Africa,Out of Africa (Hardcover),Isak Dinesen,3.89,41693,1937,https://i.gr-assets.com/images/S/compressed.photo.goodreads.com/books/1608486134l/781787._SY75_.jpg,travel
15808859-how-to-travel-the-world-on-50-a-day,"How to Travel the World on $50 a Day: Travel Cheaper, Longer, Smarter (Paperback)",Matt Kepnes,3.8,2165,2013,https://i.gr-assets.com/images/S/compressed.photo.goodreads.com/books/1404960792l/15808859._SX50_.jpg,travel
40184.Encore_Provence,Encore Provence: New Adventures in the South of France (Paperback),Peter Mayle,4.0,11287,1992,https://i.gr-assets.com/images/S/compressed.photo.goodreads.com/books/1631209526l/40184._SY75_.jpg,travel
6945572-country-driving,Country Driving: A Journey Through China from Farm to Factory (Hardcover),Peter Hessler,4.23,7130,2009,https://i.gr-assets.com/images/S/compressed.photo.goodreads.com/books/1564999953l/6945572._SY75_.jpg,travel
544339.In_Siberia,In Siberia (Paperback),Colin Thubron,3.97,2550,1999,https://i.gr-assets.com/images/S/compressed.photo.goodreads.com/books/1463255261l/544339._SY75_.jpg,travel
