Id,Title,Author,Average Rating,Number of ratings,Year of publishing,Url of image,Genre
38465.Tell_My_Horse,Tell My Horse: Voodoo and Life in Haiti and Jamaica (Paperback),Zora Neale Hurston,3.98,2017,1938,https://i.gr-assets.com/images/S/compressed.photo.goodreads.com/books/1398815237l/38465._SY75_.jpg,travel
118186.London_Orbital,London Orbital (Paperback),Iain Sinclair,3.68,704,2002,https://i.gr-assets.com/images/S/compressed.photo.goodreads.com/books/1328032557l/118186._SY75_.jpg,travel
23846253-the-unofficial-guide-to-disneyland-2016,The Unofficial Guide to Disneyland 2016 (Paperback),Bob Sehlinger,4.31,988,1985,https://i.gr-assets.com/images/S/compressed.photo.goodreads.com/books/1419320853l/23846253._SY75_.jpg,travel
427787.Tales_from_Nowhere,Tales from Nowhere (Paperback),Don George,3.65,464,2006,https://i.gr-assets.com/images/S/compressed.photo.goodreads.com/books/1348310742l/427787._SY75_.jpg,travel
40536236-sea-people,Sea People: The Puzzle of Polynesia (Hardcover),Christina Thompson,4.22,2908,2019,https://i.gr-assets.com/images/S/compressed.photo.goodreads.com/books/1542039373l/40536236._SY75_.jpg,travel
23492808-life-and-death-in-the-ande,"Life and Death in the Andes: On the Trail of Bandits, Heroes, and Revolutionaries (Hardcover)",Kim MacQuarrie,4.02,692,2015,https://i.gr-assets.com/images/S/compressed.photo.goodreads.com/books/1448828304l/23492808._SY75_.jpg,travel
372011.The_Most_Scenic_Drives_in_America,The Most Scenic Drives in America: 120 Spectacular Road Trips (Hardcover),Reader's Digest Association,4.11,271,1997,https://i.gr-assets.com/images/S/compressed.photo.goodreads.com/books/1439731115l/372011._SX50_.jpg,travel
18000729-if-your-dream-doesn-t-scare-you-it-isn-t-big-enoug,"If Your Dream Doesn't Scare You, It Isn't Big Enough: A Solo Journey Around the World (Paperback)",Kristine K. Stevens,3.58,500,2013,https://i.gr-assets.com/images/S/compressed.photo.goodreads.com/books/1370005316l/18000729._SY75_.jpg,travel
15803144-the-emerald-mile,The Emerald Mile: The Epic Story of the Fastest Ride in History Through the Heart of the Grand Canyon (Hardcover),Kevin Fedarko,4.42,7933,2013,https://i.gr-assets.com/images/S/compressed.photo.goodreads.com/books/1420938349l/15803144._SY75_.jpg,travel
12500815-backpacked,Backpacked: A Reluctant Trip Across Central America (Kindle Edition),Catherine Ryan Howard,3.68,775,2011,https://i.gr-assets.com/images/S/compressed.photo.goodreads.com/books/1345954496l/12500815._SX50_.jpg,travel
6086372-true-nort,True North: Travels in Arctic Europe (Paperback),Gavin Francis,3.97,195,2008,https://i.gr-assets.com/images/S/compressed.photo.goodreads.com/books/1334157956l/6086372._SY75_.jpg,travel
7997104-the-wave,"The Wave: In Pursuit of the Rogues, Freaks, and Giants of the Ocean (Hardcover)",Susan Casey,4.01,9584,2010,https://i.gr-assets.com/images/S/compressed.photo.goodreads.com/books/1320542851l/7997104._SY75_.jpg,travel
1088116.The_Brendan_Voyage,The Brendan Voyage: A Leather Boat Tracks the Discovery of America by the Irish Sailor Saints (Hardcover),Tim Severin,4.24,1440,1978,https://i.gr-assets.com/images/S/compressed.photo.goodreads.com/books/1387702147l/1088116._SX50_.jpg,travel
16172.Desert_Queen,"Desert Queen: The Extraordinary Life of Gertrude Bell: Adventurer, Adviser to Kings, Ally of Lawrence of Arabia (Paperback)",Janet Wallach,3.68,7005,1996,https://i.gr-assets.com/images/S/compressed.photo.goodreads.com/books/1386744057l/16172._SY75_.jpg,travel
2493.The_Time_Machine,The Time Machine (Paperback),H.G. Wells,3.9,458536,1895,https://i.gr-assets.com/images/S/compressed.photo.goodreads.com/books/1327942880l/2493._SY75_.jpg,travel
553783.Marco_Pol,Marco Polo: From Venice to Xanadu (Hardcover),Laurence Bergreen,3.82,2421,2007,https://i.gr-assets.com/images/S/compressed.photo.goodreads.com/books/1320546509l/553783._SX50_.jpg,travel
3308358-roads-to-quoz,Roads to Quoz: An American Mosey (Hardcover),William Least Heat-Moon,3.56,609,2008,https://i.gr-assets.com/images/S/compressed.photo.goodreads.com/books/1344264114l/3308358._SY75_.jpg,travel
5941.Running_in_the_Family,Running in the Family (Paperback),Michael Ondaatje,3.83,8163,1982,https://i.gr-assets.com/images/S/compressed.photo.goodreads.com/books/1405867432l/5941._SY75_.jpg,travel
105679.Expat,Expat: Women's True Tales of Life Abroad (Paperback),Christina Henry De Tessan,3.59,422,2002,https://i.gr-assets.com/images/S/compressed.photo.goodreads.com/books/1347396066l/105679._SX50_.jpg,travel
92298.Stranger_on_a_Train,Stranger on a Train (Paperback),Jenny Diski,3.87,675,2002,https://i.gr-assets.com/images/S/compressed.photo.goodreads.com/books/1349112537l/92298._SY75_.jpg,travel
4901837-the-hidden-magic-of-walt-disney-world,"The Hidden Magic of Walt Disney World: Over 600 Secrets of the Magic Kingdom, Epcot, Disney's Hollywood Studios, and Animal Kingdom (Paperback)",Susan Veness,3.86,2726,2009,https://i.gr-assets.com/images/S/compressed.photo.goodreads.com/books/1347381535l/4901837._SY75_.jpg,travel
36992483-erebu,Erebus: The Story of a Ship (Hardcover),Michael Palin,4.31,5812,2018,https://i.gr-assets.com/images/S/compressed.photo.goodreads.com/books/1524061340l/36992483._SY75_.jpg,travel
1162174.New_Zealand,New Zealand (Eyewitness Travel Guides),Kate  Poole,3.99,269,2001,https://i.gr-assets.com/images/S/compressed.photo.goodreads.com/books/1309296314l/1162174._SY75_.jpg,travel
35342935-the-food-explorer,The Food Explorer: The True Adventures of the Globe-Trotting Botanist Who Transformed What America Eats (Hardcover),Daniel Stone,3.84,2889,2018,https://i.gr-assets.com/images/S/compressed.photo.goodreads.com/books/1517467691l/35342935._SY75_.jpg,travel
31371287-driving-miss-norma,"Driving Miss Norma: One Family's Journey Saying ""Yes"" to Living (ebook)",Tim Bauerschmidt,4.22,3353,2017,https://i.gr-assets.com/images/S/compressed.photo.goodreads.com/books/1484003390l/31371287._SY75_.jpg,travel
29242437-grape-olive-pig,"Grape, Olive, Pig: Deep Travels Through Spain's Food Culture (ebook)",Matt Goulding,4.2,558,2016,https://i.gr-assets.com/images/S/compressed.photo.goodreads.com/books/1476460866l/29242437._SX50_.jpg,travel
29427108-the-best-american-travel-writing-2016,The Best American Travel Writing 2016 (The Best American Series ®),Bill Bryson,3.75,464,Null,https://i.gr-assets.com/images/S/compressed.photo.goodreads.com/books/1457239931l/29427108._SY75_.jpg,travel
22246010-the-best-place-to-be-today,The Best Place to Be Today: 365 Things to Do & the Perfect Day to Do Them (Paperback),Lonely Planet,3.91,208,2014,https://i.gr-assets.com/images/S/compressed.photo.goodreads.com/books/1405865525l/22246010._SX50_.jpg,travel
18718848-mosquitoland,Mosquitoland (Kindle Edition),David  Arnold,3.88,29859,2015,https://i.gr-assets.com/images/S/compressed.photo.goodreads.com/books/1402661616l/18718848._SY75_.jpg,travel
109724.The_Flaneur,The Flaneur: A Stroll through the Paradoxes of Paris (Hardcover),Edmund White,3.71,2015,2001,https://i.gr-assets.com/images/S/compressed.photo.goodreads.com/books/1369505859l/109724._SY75_.jpg,travel
21046525-microadventure,Microadventures: Local Discoveries for Great Escapes (Paperback),Alastair Humphreys,4.15,848,2014,https://i.gr-assets.com/images/S/compressed.photo.goodreads.com/books/1408312035l/21046525._SX50_.jpg,travel
2028053.Top_10_Scotland,Top 10 Scotland (Paperback),Alastair Scott,4.0,166,2003,https://i.gr-assets.com/images/S/compressed.photo.goodreads.com/books/1309294760l/2028053._SY75_.jpg,travel
15818376-strange-stone,Strange Stones: Dispatches from East and West (Paperback),Peter Hessler,4.15,1385,2013,https://i.gr-assets.com/images/S/compressed.photo.goodreads.com/books/1351203551l/15818376._SY75_.jpg,travel
17212231-infern,"Inferno (Robert Langdon, #4)",Dan Brown,3.86,512815,2013,https://i.gr-assets.com/images/S/compressed.photo.goodreads.com/books/1534070896l/17212231._SY75_.jpg,travel
6913830-blind-descent,Blind Descent: The Quest to Discover the Deepest Place on Earth (Hardcover),James M. Tabor,3.72,3469,2010,https://i.gr-assets.com/images/S/compressed.photo.goodreads.com/books/1442899413l/6913830._SY75_.jpg,travel
7223678-world-heritage-site,World Heritage Sites: A Complete Guide to 890 UNESCO World Heritage Sites (Paperback),UNESCO,4.16,168,2009,https://i.gr-assets.com/images/S/compressed.photo.goodreads.com/books/1348224321l/7223678._SX50_.jpg,travel
39092290-lost-horizon,Lost Horizon (Kindle Edition),James Hilton,3.94,19228,1933,https://i.gr-assets.com/images/S/compressed.photo.goodreads.com/books/1520611938l/39092290._SY75_.jpg,travel
4981.Slaughterhouse_Five,Slaughterhouse-Five (Paperback),Kurt Vonnegut Jr.,4.08,1218071,1969,https://i.gr-assets.com/images/S/compressed.photo.goodreads.com/books/1606208827l/4981._SY75_.jpg,travel
422755.The_Journal,The Journals (Paperback),James Cook,3.9,776,1906,https://i.gr-assets.com/images/S/compressed.photo.goodreads.com/books/1413749131l/422755._SY75_.jpg,travel
1592698.Thrilling_Citie,Thrilling Cities (Paperback),Ian Fleming,3.53,728,1963,https://i.gr-assets.com/images/S/compressed.photo.goodreads.com/books/1294258498l/1592698._SY75_.jpg,travel
807284.Weird_U_S_,Weird U.S.: Your Travel Guide to America's Local Legends and Best Kept Secrets (Weird Travel Guides),Mark Moran,3.99,879,2004,https://i.gr-assets.com/images/S/compressed.photo.goodreads.com/books/1328857345l/807284._SX50_.jpg,travel
567702.Raw_Spirit,Raw Spirit: In Search of the Perfect Dram (Hardcover),Iain Banks,3.69,1569,2003,https://i.gr-assets.com/images/S/compressed.photo.goodreads.com/books/1387733436l/567702._SX50_.jpg,travel
2846420-by-any-mean,By Any Means: His Brand New Adventure from Wicklow to Wollongong (Hardcover),Charley Boorman,3.69,536,2008,https://i.gr-assets.com/images/S/compressed.photo.goodreads.com/books/1328707304l/2846420._SY75_.jpg,travel
837297.Clear_Waters_Rising,Clear Waters Rising: A Mountain Walk Across Europe (Paperback),Nicholas Crane,3.99,337,1996,https://i.gr-assets.com/images/S/compressed.photo.goodreads.com/books/1356460485l/837297._SY75_.jpg,travel
613606.Wanderlust_and_Lipstic,Wanderlust and Lipstick: The Essential Guide for Women Traveling Solo (Paperback),Beth Whitman,3.4,210,2007,https://i.gr-assets.com/images/S/compressed.photo.goodreads.com/books/1328765019l/613606._SY75_.jpg,travel
12051.Their_Heads_are_Green_and_Their_Hands_are_Blue,Their Heads are Green and Their Hands are Blue: Scenes from the Non-Christian World (Paperback),Paul Bowles,4.06,561,1957,https://i.gr-assets.com/images/S/compressed.photo.goodreads.com/books/1407709353l/12051._SY75_.jpg,travel
181257.Trail_of_Feather,Trail of Feathers: In Search of the Birdmen of Peru (Paperback),Tahir Shah,3.92,487,2001,https://i.gr-assets.com/images/S/compressed.photo.goodreads.com/books/1172502980l/181257._SY75_.jpg,travel
40186.Acquired_Taste,Acquired Tastes (Paperback),Peter Mayle,3.67,1801,1991,https://i.gr-assets.com/images/S/compressed.photo.goodreads.com/books/1388408584l/40186._SY75_.jpg,travel
48137.A_Zoo_in_My_Luggage,A Zoo in My Luggage (Paperback),Gerald Durrell,4.11,4598,1960,https://i.gr-assets.com/images/S/compressed.photo.goodreads.com/books/1386922188l/48137._SX50_.jpg,travel
181255.Sorcerer_s_Apprentice,Sorcerer's Apprentice (Paperback),Tahir Shah,4.17,973,1998,https://i.gr-assets.com/images/S/compressed.photo.goodreads.com/books/1386913899l/181255._SY75_.jpg,travel
411540.Istanbul,Istanbul (DK Eyewitness Travel Guide),Melissa Shales,4.17,245,1998,https://i.gr-assets.com/images/S/compressed.photo.goodreads.com/books/1174515622l/411540._SY75_.jpg,travel
369119.Portugal,Portugal (DK Eyewitness Travel Guides),Martin Symington,4.13,225,1997,https://i.gr-assets.com/images/S/compressed.photo.goodreads.com/books/1309294757l/369119._SY75_.jpg,travel
36076549-bella-figura,"Bella Figura: How to Live, Love, and Eat the Italian Way (Hardcover)",Kamin Mohammadi,3.67,2577,2018,https://i.gr-assets.com/images/S/compressed.photo.goodreads.com/books/1513340204l/36076549._SX50_.jpg,travel
34912895-the-great-alone,The Great Alone (Kindle Edition),Kristin Hannah,4.35,489950,2018,https://i.gr-assets.com/images/S/compressed.photo.goodreads.com/books/1501852423l/34912895._SY75_.jpg,travel
29922044-lonely-planet-amsterdam,Lonely Planet Amsterdam (Travel Guide),Catherine Le Nevez,4.05,367,1997,https://i.gr-assets.com/images/S/compressed.photo.goodreads.com/books/1460738129l/29922044._SY75_.jpg,travel
111780.The_Corfu_Trilogy,The Corfu Trilogy (The Corfu Trilogy #1-3),Gerald Durrell,4.48,5376,2006,https://i.gr-assets.com/images/S/compressed.photo.goodreads.com/books/1348838616l/111780._SY75_.jpg,travel
32056784-lonely-planet-costa-rica,Lonely Planet Costa Rica (Travel Guide),Lonely Planet,3.99,408,1997,https://i.gr-assets.com/images/S/compressed.photo.goodreads.com/books/1473982858l/32056784._SY75_.jpg,travel
30213945-50-states-5-000-idea,"50 States, 5,000 Ideas: Where to Go, When to Go, What to See, What to Do (Paperback)",Joe Yogerst,3.86,305,Null,https://i.gr-assets.com/images/S/compressed.photo.goodreads.com/books/1471295085l/30213945._SX50_.jpg,travel
30236772-my-italian-bulldozer,My Italian Bulldozer (Kindle Edition),Alexander McCall Smith,3.56,8658,2017,https://i.gr-assets.com/images/S/compressed.photo.goodreads.com/books/1463698885l/30236772._SY75_.jpg,travel
22580996-the-lost-art-of-reading-nature-s-sign,"The Lost Art of Reading Nature's Signs: Use Outdoor Clues to Find Your Way, Predict the Weather, Locate Water, Track Animals—and Other Forgotten Skills (Paperback)",Tristan Gooley,3.75,3067,2014,https://i.gr-assets.com/images/S/compressed.photo.goodreads.com/books/1430085428l/22580996._SX50_.jpg,travel
86573.The_Adventures_of_Ibn_Battuta,"The Adventures of Ibn Battuta: A Muslim Traveler of the Fourteenth Century, Revised Edition, with a New Preface (Paperback)",Ross E. Dunn,3.82,634,1987,https://i.gr-assets.com/images/S/compressed.photo.goodreads.com/books/1348066867l/86573._SX50_.jpg,travel
968.The_Da_Vinci_Code,"The Da Vinci Code (Robert Langdon, #2)",Dan Brown,3.88,2095487,2003,https://i.gr-assets.com/images/S/compressed.photo.goodreads.com/books/1579621267l/968._SY75_.jpg,travel
113380.Maiden_Voyage,Maiden Voyage (Paperback),Tania Aebi,4.15,2697,1989,https://i.gr-assets.com/images/S/compressed.photo.goodreads.com/books/1347250295l/113380._SY75_.jpg,travel
18594406-the-emperor-far-away,The Emperor Far Away: Travels at the Edge of China (Hardcover),David Eimer,3.94,630,2014,https://i.gr-assets.com/images/S/compressed.photo.goodreads.com/books/1400996221l/18594406._SY75_.jpg,travel
15790837-let-s-explore-diabetes-with-owl,Let's Explore Diabetes with Owls (Hardcover),David Sedaris,3.82,134131,2013,https://i.gr-assets.com/images/S/compressed.photo.goodreads.com/books/1359704028l/15790837._SY75_.jpg,travel
13594211-almost-somewhere,Almost Somewhere: Twenty-Eight Days on the John Muir Trail (Paperback),Suzanne   Roberts,3.81,1505,2012,https://i.gr-assets.com/images/S/compressed.photo.goodreads.com/books/1369093117l/13594211._SY75_.jpg,travel
831001.I_Never_Knew_That_About_London,I Never Knew That About London (Hardcover),Christopher Winn,3.76,474,2007,https://i.gr-assets.com/images/S/compressed.photo.goodreads.com/books/1320520072l/831001._SX50_.jpg,travel
9304907-to-timbuktu,"To Timbuktu: Nine Countries, Two People, One True Story (Paperback)",Steven  Weinberg,3.7,436,2011,https://i.gr-assets.com/images/S/compressed.photo.goodreads.com/books/1312062007l/9304907._SX50_.jpg,travel
6519311-the-national-par,The National Parks: America's Best Idea (Hardcover),Dayton Duncan,4.34,1466,2009,https://i.gr-assets.com/images/S/compressed.photo.goodreads.com/books/1320462479l/6519311._SX50_.jpg,travel
29597.Through_Painted_Desert,"Through Painted Deserts: Light, God, and Beauty on the Open Road (Paperback)",Donald Miller,3.87,11073,2005,https://i.gr-assets.com/images/S/compressed.photo.goodreads.com/books/1442278294l/29597._SY75_.jpg,travel
10768.Merde_Actually,Merde Actually (Paperback),Stephen Clarke,3.57,4565,2005,https://i.gr-assets.com/images/S/compressed.photo.goodreads.com/books/1347862435l/10768._SY75_.jpg,travel
4137.Me_Talk_Pretty_One_Day,Me Talk Pretty One Day (Paperback),David Sedaris,3.99,655832,2000,https://i.gr-assets.com/images/S/compressed.photo.goodreads.com/books/1431013639l/4137._SY75_.jpg,travel
137981.Seven_Ages_of_Pari,Seven Ages of Paris (Paperback),Alistair Horne,3.92,2206,2002,https://i.gr-assets.com/images/S/compressed.photo.goodreads.com/books/1320557142l/137981._SY75_.jpg,travel
6055.A_Voyage_for_Madmen,A Voyage for Madmen (Paperback),Peter Nichols,4.3,4310,1997,https://i.gr-assets.com/images/S/compressed.photo.goodreads.com/books/1348623648l/6055._SY75_.jpg,travel
597.Killing_Yourself_to_Live,Killing Yourself to Live: 85% of a True Story (Paperback),Chuck Klosterman,3.81,28007,2005,https://i.gr-assets.com/images/S/compressed.photo.goodreads.com/books/1523544180l/597._SY75_.jpg,travel
516995.Vienna,Vienna (Paperback),Stephen Brook,4.02,235,1994,https://i.gr-assets.com/images/S/compressed.photo.goodreads.com/books/1309296247l/516995._SY75_.jpg,travel
72457.Continental_Drifter,Continental Drifter (Paperback),Tim Moore,3.7,378,2001,https://i.gr-assets.com/images/S/compressed.photo.goodreads.com/books/1421009125l/72457._SY75_.jpg,travel
86862.Cross_Country,"Cross Country: Fifteen Years and Ninety Thousand Miles on the Roads and Interstates of America Lewis and Clark, a Lot of Bad Motels, a Moving Van, Emily Post, Jack Kerouac, My Wife, My Mother-In-Law, Two Kids and Enough Coffee to Kill an Elephant (Hardcover)",Robert Sullivan,3.33,312,2006,https://i.gr-assets.com/images/S/compressed.photo.goodreads.com/books/1312043927l/86862._SY75_.jpg,travel
383761.Rowing_to_Latitude,Rowing to Latitude: Journeys Along the Arctic's Edge (Paperback),Jill Fredston,4.14,1006,2001,https://i.gr-assets.com/images/S/compressed.photo.goodreads.com/books/1312058072l/383761._SX50_.jpg,travel
187247.Barcelona_Catalonia,Barcelona & Catalonia (Paperback),Catherine Day,4.19,273,1993,https://i.gr-assets.com/images/S/compressed.photo.goodreads.com/books/1309293435l/187247._SY75_.jpg,travel
40492267-one-more-croissant-for-the-road,One More Croissant for the Road (Hardcover),Felicity Cloake,3.94,1566,Null,https://i.gr-assets.com/images/S/compressed.photo.goodreads.com/books/1562171457l/40492267._SY75_.jpg,travel
40697749-literary-place,Literary Places (Inspired Traveller's Guide),Sarah  Baxter,3.63,358,2019,https://i.gr-assets.com/images/S/compressed.photo.goodreads.com/books/1550714059l/40697749._SX50_.jpg,travel
36200760-epic-hikes-of-the-world,Epic Hikes of the World (Hardcover),Alex Crevar,4.2,259,Null,https://i.gr-assets.com/images/S/compressed.photo.goodreads.com/books/1513805463l/36200760._SX50_.jpg,travel
46127.Spain,Spain (Eyewitness Travel Guides),John Ardagh,4.19,236,1998,https://i.gr-assets.com/images/S/compressed.photo.goodreads.com/books/1388346747l/46127._SY75_.jpg,travel
34347751-l-appart,L'Appart: The Delights and Disasters of Making My Paris Home (Hardcover),David Lebovitz,3.63,4028,2017,https://i.gr-assets.com/images/S/compressed.photo.goodreads.com/books/1498799813l/34347751._SX50_.jpg,travel
33517046-ruthless-river,Ruthless River: Love and Survival by Raft on the Amazon's Relentless Madre de Dios (Paperback),Holly Conklin FitzGerald,4.03,2343,2017,https://i.gr-assets.com/images/S/compressed.photo.goodreads.com/books/1491721417l/33517046._SY75_.jpg,travel
59661.Shah_of_Sha,Shah of Shahs (Paperback),Ryszard Kapuściński,4.24,5683,1982,https://i.gr-assets.com/images/S/compressed.photo.goodreads.com/books/1407710588l/59661._SY75_.jpg,travel
30039019-havana,Havana: A Subtropical Delirium (Hardcover),Mark Kurlansky,3.89,1157,2017,https://i.gr-assets.com/images/S/compressed.photo.goodreads.com/books/1484907141l/30039019._SY75_.jpg,travel
44509.The_Best_American_Travel_Writing_2006,The Best American Travel Writing 2006 (Paperback),Tim Cahill,3.94,520,Null,https://i.gr-assets.com/images/S/compressed.photo.goodreads.com/books/1388236354l/44509._SY75_.jpg,travel
29869.New_Yor,New York (Paperback),Annelise Sorensen,4.29,493,1993,https://i.gr-assets.com/images/S/compressed.photo.goodreads.com/books/1386920135l/29869._SY75_.jpg,travel
21976060-the-art-of-stillne,The Art of Stillness: Adventures in Going Nowhere (Hardcover),Pico Iyer,3.67,7770,2014,https://i.gr-assets.com/images/S/compressed.photo.goodreads.com/books/1418670911l/21976060._SX50_.jpg,travel
6105931-last-chance-to-see,Last Chance to See: In the Footsteps of Douglas Adams (Hardcover),Mark Carwardine,4.41,2711,2009,https://i.gr-assets.com/images/S/compressed.photo.goodreads.com/books/1347399860l/6105931._SX50_.jpg,travel
8679302-life-is-a-trip,Life Is a Trip: The Transformative Magic of Travel (Paperback),Judith Fein,3.35,351,2010,https://i.gr-assets.com/images/S/compressed.photo.goodreads.com/books/1355037986l/8679302._SY75_.jpg,travel
7199961-in-a-strange-room,In a Strange Room (Hardcover),Damon Galgut,3.59,3386,2010,https://i.gr-assets.com/images/S/compressed.photo.goodreads.com/books/1356463430l/7199961._SY75_.jpg,travel
7933560-the-great-typo-hunt,"The Great Typo Hunt: Two Friends Changing the World, One Correction at a Time (Hardcover)",Jeff Deck,3.19,1264,2010,https://i.gr-assets.com/images/S/compressed.photo.goodreads.com/books/1320542311l/7933560._SY75_.jpg,travel
6452760-stones-into-school,"Stones Into Schools: Promoting Peace With Books, Not Bombs, in Afghanistan and Pakistan (Hardcover)",Greg Mortenson,3.86,16652,2009,https://i.gr-assets.com/images/S/compressed.photo.goodreads.com/books/1260845553l/6452760._SY75_.jpg,travel
6413245-cold,Cold: Adventures in the World's Frozen Places (Hardcover),Bill Streever,3.61,1294,2009,https://i.gr-assets.com/images/S/compressed.photo.goodreads.com/books/1344270985l/6413245._SY75_.jpg,travel
6147358-eat-my-globe,Eat My Globe: One Year to Go Everywhere and Eat Everything (Hardcover),Simon Majumdar,3.47,595,2009,https://i.gr-assets.com/images/S/compressed.photo.goodreads.com/books/1348440627l/6147358._SY75_.jpg,travel
283786.Hideous_Kinky,Hideous Kinky (Paperback),Esther Freud,3.48,3373,1992,https://i.gr-assets.com/images/S/compressed.photo.goodreads.com/books/1437975005l/283786._SX50_.jpg,travel
327742.Eastern_Approache,Eastern Approaches (Paperback),Fitzroy Maclean,4.43,1274,1949,https://i.gr-assets.com/images/S/compressed.photo.goodreads.com/books/1356448161l/327742._SY75_.jpg,travel
236793.The_Exploration_of_the_Colorado_River_and_Its_Canyon,The Exploration of the Colorado River and Its Canyons (Paperback),John Wesley Powell,3.92,1795,1895,https://i.gr-assets.com/images/S/compressed.photo.goodreads.com/books/1386922853l/236793._SY75_.jpg,travel
4327387-adventures-on-the-high-tea,Adventures on the High Teas: In Search of Middle England (Paperback),Stuart Maconie,3.65,802,2009,https://i.gr-assets.com/images/S/compressed.photo.goodreads.com/books/1320527242l/4327387._SY75_.jpg,travel
6011287-dreaming-in-hindi,Dreaming in Hindi: Coming Awake in Another Language (Hardcover),Katherine Russell Rich,3.1,1151,2009,https://i.gr-assets.com/images/S/compressed.photo.goodreads.com/books/1348350728l/6011287._SY75_.jpg,travel
3491072-200,حول العالم في 200 يوم (Hardcover),أنيس منصور,4.08,10942,1963,https://i.gr-assets.com/images/S/compressed.photo.goodreads.com/books/1213949039l/3491072._SX50_.jpg,travel
143428.I_Married_Adventure,I Married Adventure: The Lives of Martin and Osa Johnson (Paperback),Osa Johnson,4.12,745,1940,https://i.gr-assets.com/images/S/compressed.photo.goodreads.com/books/1397436167l/143428._SY75_.jpg,travel
3397706-state-by-state,State by State: A Panoramic Portrait of America (Hardcover),Matt Weiland,3.75,1264,2008,https://i.gr-assets.com/images/S/compressed.photo.goodreads.com/books/1347441159l/3397706._SY75_.jpg,travel
1182546.I_Should_Have_Stayed_Home,I Should Have Stayed Home: The Worst Trips of Great Writers (Paperback),Roger Rapoport,3.39,258,1994,https://i.gr-assets.com/images/S/compressed.photo.goodreads.com/books/1347254691l/1182546._SY75_.jpg,travel
534257.You_Can_t_Get_There_from_Here,You Can't Get There from Here: A Year on the Fringes of a Shrinking World (Paperback),Gayle Forman,3.52,411,2005,https://i.gr-assets.com/images/S/compressed.photo.goodreads.com/books/1440817736l/534257._SY75_.jpg,travel
217763.Fly_Sol,Fly Solo: The 50 Best Places on Earth for a Girl to Travel Alone (Paperback),Teresa Rodriguez Williamson,3.37,184,2007,https://i.gr-assets.com/images/S/compressed.photo.goodreads.com/books/1439485490l/217763._SY75_.jpg,travel
161892.A_Small_Place_in_Italy,A Small Place in Italy (Paperback),Eric Newby,3.81,545,1994,https://i.gr-assets.com/images/S/compressed.photo.goodreads.com/books/1298455804l/161892._SY75_.jpg,travel
128534.Off_the_Road,Off the Road: A Modern-Day Walk Down the Pilgrim's Route into Spain (Paperback),Jack Hitt,3.68,655,1994,https://i.gr-assets.com/images/S/compressed.photo.goodreads.com/books/1347477576l/128534._SY75_.jpg,travel
36384777-rick-steves-florence-tuscany,Rick Steves Florence & Tuscany (Kindle Edition),Rick Steves,4.31,619,2003,https://i.gr-assets.com/images/S/compressed.photo.goodreads.com/books/1507608113l/36384777._SY75_.jpg,travel
24611933-a-beginner-s-guide-to-paradise,"A Beginner's Guide to Paradise: 9 Steps to Giving Up Everything So You Too Can: Move to a South Pacific Island, Wear a Loincloth, Read a Hundred Books, Diaper a Baby Monkey, Build a Bungalow, (Hardcover)",Alex  Sheshunoff,3.67,433,2015,https://i.gr-assets.com/images/S/compressed.photo.goodreads.com/books/1430966205l/24611933._SY75_.jpg,travel
43521707-how-to-be-a-family,How to Be a Family: The Year I Dragged My Kids Around the World to Find a New Way to Be Together (Hardcover),Dan Kois,3.72,1403,2019,https://i.gr-assets.com/images/S/compressed.photo.goodreads.com/books/1565067465l/43521707._SY75_.jpg,travel
